,Unnamed: 0,Artist,Album,Song Title,Producer,Lyrics,neg,neu,pos,compound
0,0,Ellie Goulding,Delirium (Target Exclusive),Aftertaste,Greg Kurstin,"Hold me like nobody else does Do I get the best of your love? Even when our bodies are drunk Is it me you're stumbling from? Forget the words that you said With your fingers spell out my name Take away the sky in our breath Remember love is a game, love is a game  Don't break, don't fade While we're not real, we're never too late Make time, it won’t hurt Said I’ll go now, but you said it first  I know there's nothing that I can do to make you stay But one thing I know that will always remain And that's the aftertaste The aftertaste The aftertaste The aftertaste The aftertaste  In the midst I'm seeing your face And I can't believe this is fake Blow the blossom into your room As you throw me in disarray There's a button that I need to press There's a face that I need to kiss Come on, give me your heart and your head Make you conscious never resist, never resist You might also like Don't break, don't fade While we're not real, we're never too late Make time, it won’t hurt Said I’ll go now, but you said it first  I know there's nothing that I can do to make you stay But one thing I know that will always remain And that's the aftertaste The aftertaste The aftertaste The aftertaste The aftertaste I know there's nothing that I can do to make you stay But one thing I know that will always remain And that's the aftertaste The aftertaste The aftertaste The aftertaste The aftertaste The aftertaste The aftertaste The aftertaste The aftertaste3Embed",0.026,0.87,0.104,0.9639
1,1,Ellie Goulding,,All I See Is You (Demo),,How could i be sorry if i don't know the crime I should be mad but you never told me why? Still I can't seem to say goodbye You (yeah) When i try to fall back i fall back to you (yeah) When i talk to my friends i talk about you (yeah) When the hennessy is strong all i see is you (is you) You (yeah) No i haven't moved on but trust me i try (yeah) If i give you a call don't hang up the line (yeah) Cus the hennessy is strong all i see is you (is you) Making me the saddest But i kinda want a lonely night Thinking about the salvage Thе things i use to do to you when you werе mine Wish that i still had it Baby you posses my mind You knew me at my baddest Do you know i would never even cross the line? How could you ever leave me without a chance to try How could i be sorry if i don't know the crime I should be mad but you never told me why? Still I can't seem to say goodbye You might also likeYou (yeah) When i try to fall back i fall back to you (yeah) When i talk to my friends i talk about you (yeah) When the hennessy is strong all i see is you (is you) You (yeah) No i haven't moved on but trust me i try (yeah) If i give you a call don't hang up the line (yeah) Cus the hennessy is strong all i see is you (is you) I see your face in every stranger everywhere i go Hear your voice in conversation every word you spoke Nearly blocked you from my phone about a thousand times I know i should say goodbye You (yeah) When i try to fall back i fall back to you (yeah fall back to you baby) When i talk to my friends i talk about you (yeah) When the hennessy is strong all i see is you (all i see is you) You (yeah) No i haven't moved on but trust me i try (yeah) If i give you a call don't hang up the line (yeah) Cus the hennessy is strong all i see is you (is you) All i see is you All i see is you Yeah Is you All you1Embed,0.07,0.674,0.256,0.998
2,2,Ellie Goulding,,All I Want,,"All I want is nothing more To hear you knocking at my door 'Cause if I could see your face once more I'd die a happy woman, I'm sure When you said your last goodbye I died a little bit inside I lay in tears in bed all night Alone without you by my side  But if you loved me, why'd you leave me? Take my body, take my body All I want is, and all I need is To find somebody, I'll find somebody Like you, like you, like you-ou  'Cause you brought out the best of me Part of me you've never seen You took my soul and wiped it clean Our love was made for movie screens  But if you loved me, why'd you leave me? Take my body, take my body All I want is, and all I need is To find somebody, I'll find somebody You might also like  If you loved me, why'd you leave me? Take my body, take my body All I want is, and all I need is To find somebody, I'll find somebody Like youEmbed",0.101,0.646,0.253,0.99
3,3,Ellie Goulding,Bright Lights,Animal,Starsmith,"I'll show you all of the places I'm dreaming of I'll take you to the ocean, I'll bring the sun We are seventeen, we have just begun I have love to fight for and then some But you are the one The one, the one, the one, the one, the one, the one, the one  Wake up in the morning, we're paralyzed We'll fly into the garden like butterflies There will be no blood and there'll be no pain I want to fall in love with you again Again again again again again again again again again  You have stolen all my senses There's a fever in my heart And you are taking my defenses You are pulling me apart Forever we're young and we are dying And we will be spilling all our blood So I will take away my feelings I will be an animal An animal An animal You might also like I'll tie you in my arms, I will smother you We'll tell each other lies like we tell the truth I'll colour in the sky and I'll colour you I want to draw on your skin again Again again again again again again again again  You have stolen all my senses There's a fever in my heart And you are taking my defenses You are pulling me apart Forever we're young and we are dying And we will be spilling all our blood So I will take away my feelings I will be an animal An animal An animal  We will run away from danger We will run away  You have stolen all my senses There's a fever in my heart And you are taking my defenses You are pulling me apart Forever we're young and we are dying And we will be spilling all our blood So I will take away my feelings I will be an animal An animal An animalEmbed",0.147,0.756,0.097,-0.9686
4,4,Ellie Goulding,Halcyon (Deluxe Version),Anything Could Happen,Jim Eliot & Ellie Goulding,"Stripped to the waist, we fall into the river Cover your eyes so you don't know the secret I've been trying to hide We held our breath to see our names are written On the wreck of '86 That was the year I knew the panic was over  Yes, since we found out, since we found out That anything could happen, anything could happen Anything could happen, anything could happen Anything could happen, anything could happen Anything could   After the war, we said we'd fight together I guess we thought that's just what humans do Letting darkness grow As if we need its palette and we need its colour  But now I've seen it through and now I know the truth That anything could happen, anything could happen Anything could happen, anything could happen Anything could happen, anything could happen Anything could You might also like  Baby, I'll give you everything you need I'll give you everything you need, oh I'll give you everything you need But I don't think I need you  Stripped to the waist, we fall into the river Cover your eyes so you don't know the secret I've been trying to hide We held our breath to see our names are written On the wreck of '86 That was the year I knew the panic was over  Yes, since we found out, since we found out That anything could happen, anything could happen Anything could happen, anything could happen Anything could happen, anything could happen Anything could  I know it's gonna be, I know it's gonna be I know it's gonna be, I know it's gonna be I know it's gonna be, I know it's gonna be I know it's gonna be, I know it's gonna be, oh (But I don't think I need you) (But I don't think I need you) (But I don't think I need you) (But I don't think I need you)39Embed",0.115,0.85,0.035,-0.9728
5,5,Ellie Goulding,,Anything Could Happen (Alex Metric Remix),,Stripped to the waist We fall into the river Cover your eyes So you don't know the secret I've been trying to hide We held our breath To see our names are written On the wreck of '86 That was the year I knew the panic was over  Yes since we found out Since we found out  That anything could happen Anything could happen Anything could happen Anything could happen Anything could happen Anything could happen Anything could happen Anything could happen Anything could happen Anything could happen Anything could happen Anything could happen Anything could happen Anything could happen Anything could happen You might also like Stripped to the waist We fall into the river Cover your eyes So you don't know the secret I've been trying to hide We held our breath To see our names are written On the wreck of '86 That was the year I knew the panic was over  Yes since we found out Since we found out  That anything could happen Anything could happen Anything could happen Anything could happen Anything could happen Anything could happen Anything could happen Anything could happen Anything could happen Anything could happen Anything could happen Anything could happen Anything could happen Anything could happen Anything could happenEmbed,0.093,0.872,0.035,-0.9022
6,6,Ellie Goulding,,Anything Could Happen (Blood Diamonds Remix),BloodPop® & Ellie Goulding & Jim Eliot,"We fall into the river Cover your eyes So you don't know the secret I've been trying to hide We held our breath To see our names are written On the wreck of '86 That was the year I knew the panic was over Yes since we found out Since we found out That anything could happen Anything could happen Anything could happen Anything could happen Anything could happen Anything could happen Anything could After the war we said we'd fight together I guess we thought that's just what humans do Letting darkness grow As if we need its palette and we need its colour But now I've seen it through And now I know the truth That anything could happen Anything could happen Anything could happen Anything could happen Anything could happen Anything could happen Anything could Baby, I'll give you everything you need I'll give you everything you need, oh I'll give you everything you need But I don't think I need you Stripped to the waist We fall into the river Cover your eyes So you don't know the secret I've been trying to hide We held our breath To see our names are written On the wreck of '86 That was the year I knew the panic was over Yes since we found out Since we found out That anything could happen Anything could happen Anything could happen Anything could happen Anything could happen Anything could happen Anything could I know it's gonna be I know it's gonna be I know it's gonna be I know it's gonna be I know it's gonna be I know it's gonna be I know it's gonna be I know it's gonna be But I don't think I need you But I don't think I need you But I don't think I need youYou might also likeEmbed",0.12,0.854,0.026,-0.9788
7,7,Ellie Goulding,,Anything could happen - radio 1 live lounge version,,"Cover your eyes, so you don't know the secret I've been trying to hide, we held our breath To see our names are written on the wreck of '86 That was the year I knew the panic was over Yes since we found out, since we found out That anything could happen, anything could happen Anything could happen, anything could happen Anything could happen, anything could happen Anything could After the war we said we'd fight together I guess we thought that's just what humans do Letting darkness grow, as if we need its palette and we need Its color But now I've seen it through and now I know the truth That anything could happen, anything could happen Anything could happen, anything could happen Anything could happen, anything could happen Anything could Baby, I'll give you everything you need I'll give you everything you need, oh I'll give you everything you need But I don't think I need you You might also likeI know it's gonna be, I know it's gonna be I know it's gonna be, I know it's gonna be I know it's gonna be, I know it's gonna be I know it's gonna be, I know it's gonna be But I don't think I need you, but I don't think I need you But I don't think I need you, but I don't think I need youEmbed",0.106,0.873,0.021,-0.946
8,8,Ellie Goulding,,Anything Could Happen - Radio Edit,,"Cover your eyes, so you don't know the secret I've been trying to hide, we held our breath To see our names are written on the wreck of '86 That was the year I knew the panic was over Yes since we found out, since we found out That anything could happen, anything could happen Anything could happen, anything could happen Anything could happen, anything could happen Anything could After the war we said we'd fight together I guess we thought that's just what humans do Letting darkness grow, as if we need its palette and we need its color But now I've seen it through and now I know the truth That anything could happen, anything could happen Anything could happen, anything could happen Anything could happen, anything could happen Anything could Baby, I'll give you everything you need I'll give you everything you need, oh I'll give you everything you need But I don't think I need you You might also likeI know it's gonna be, I know it's gonna be I know it's gonna be, I know it's gonna be I know it's gonna be, I know it's gonna be I know it's gonna be, I know it's gonna be But I don't think I need you, but I don't think I need you But I don't think I need you, but I don't think I need youEmbed",0.106,0.873,0.021,-0.946
9,9,Ellie Goulding,Halcyon (Tesco Exclusive),Anything Could Happen (White Sea Remix),Jim Eliot & Ellie Goulding,"Cover your eyes so you don't know the secret I've been trying to hide We held our breath to see our names are written On the wreck of '86 That was the year I knew the panic was over Yes, since we found out Since we found out That anything could happen Anything could happen Anything could happen Anything could happen Anything could happen Anything could happen Anything could After the war we said we'd fight together I guess we thought that's just what humans do Letting darkness grow As if we need its palette and we need its colour But now I've seen it through And now I know the truth You might also likeBaby, I'll give you everything you need I'll give you everything you need, oh I'll give you everything you need But I don't think I need you Stripped to the waist We fall into the river Cover your eyes So you don't know the secret I've been trying to hide We held our breath To see our names are written On the wreck of '86 That was the year I knew the panic was over Yet since we found out Since we found out That anything could happen Anything could happen Anything could happen Anything could happen Anything could happen Anything could happen Anything could I know it's gonna be I know it's gonna be I know it's gonna be I know it's gonna be I know it's gonna be I know it's gonna be I know it's gonna be I know it's gonna be Oh, whoa But I don't think I need you But I don't think I need you But I don't think I need you But I don't think I need youEmbed",0.128,0.855,0.016,-0.9835
10,10,Ellie Goulding,,Are You Happy Now?,,"I didn't know the eyes, but I recognized your face I read what you're doing and doing it in style Last year I might have cried, but tonight I'll try to smile Are you happy now? I let your birthday pass, I met your friends at last I didn't even ask if you're happy now I barely made each night Somehow the days rolled by The part that loved you died Are you happy now? Saw you walking in the rain and holding no one's hand I started feeling things that I couldn't understand Now you're swinging from my heart, I'm ringing up my friends ""Before it all begins,"" they say, "" remember how it ends"" Are you happy now? I let your birthday pass, I met your friends at last I didn't even ask if you're happy now I barely made each night Somehow the days rolled by The part that loved you died Are you happy now? You might also likeSaw you walking in the rain and holding no one's hand You're swinging from my heart, I'm ringing up my friends And are you happy now?Embed",0.092,0.597,0.312,0.9959
11,11,Ellie Goulding,Delirium (Target Exclusive),Army,Max Martin & Ali Payami," I know that I've been messed up You never let me give up All the nights and the fights And the blood and the breakups You're always there to call up I'm a pain, I'm a child, I'm afraid But yeah, you understand Yeah like no one can I know that we don't look like much But no one fucks it up like us  16 and you never even judged me Matter of fact I always thought you were too cool for me Sitting there in the caravan All the nights we've been drunk on the floor And yeah you understand Yeah like no one can We both know what they say about us But they don't stand a chance because  When I'm with you When I'm with you I'm standing with an army I'm standing with an army When I'm with you When I'm with you I'm standing with an army Standing with an army You might also like Dark times, you can always find the bright side I'm amazed by the things that you would sacrifice Just to be there for me How you cringe when you sing out of tune And yeah it's everything So don't change a thing We both know what they say about us But they don't stand a chance because  When I'm with you When I'm with you I'm standing with an army I'm standing with an army When I'm with you When I'm with you I'm standing with an army Standing with an army  Standing with an army Standing with an army Standing with an army Standing with an army (I'll be yours) Standing with an army Standing with an army I'm standing with an army Yeah you understand Yeah like no one can We both know what they say about us  When I'm with you When I'm with you I'm standing with an army I'm standing with an army When I'm with you When I'm with you I'm standing with an army They don't have a chance either  Standing with an army Standing with an army Standing with an army Standing with an army Standing with an army Standing with an army Standing near you Standing with an army Standing with an army Standing with an army Standing with an army Standing with an army Standing with an army When I'm with you Standing with an army13Embed",0.077,0.807,0.116,0.9594
12,12,Ellie Goulding,,Army - Orchestral Abbey Road Performance / Live,,"I know that I've been messed up You never let me give up All the nights and the fights And the blood and the breakups You're always there to call up I'm a pain, I'm a child, I'm afraid But yeah, you understand Yeah like no one can I know that we don't look like much But no one screws it up like us  16 and you never even judged me Matter of fact I always thought you were too cool for me Sitting there in the caravan All the nights we've been drunk on the floor And yeah you understand Yeah like no one can We both know what they say about us But they don't stand a chance because  When I'm with you When I'm with you I'm standing with an army I'm standing with an army When I'm with you When I'm with you I'm standing with an army Standing with an army You might also like Dark times, you can always find the bright side I'm amazed by the things that you would sacrifice Just to be there for me How you cringe when you sing out of tune And yeah it's everything So don't change a thing We both know what they say about us But they don't stand a chance because  When I'm with you When I'm with you I'm standing with an army I'm standing with an army When I'm with you When I'm with you I'm standing with an army Standing with an army  Standing with an army Standing with an army Standing with an army Standing with an army Standing with an army Standing with an army Standing with an army Yeah you understand Yeah like no one can We both know what they say about us  When I'm with you When I'm with you I'm standing with an army I'm standing with an army When I'm with you When I'm with you I..... I'm standing with an army, oh, baby I'm standing with an armyEmbed",0.071,0.792,0.137,0.9791
13,13,Ellie Goulding,Delirium (Target Exclusive),Around U,Greg Kurstin,"I just want to be around you Is that too much to ask? I just want to be around you Is that too much to ask?  When I look into your eyes Boy, I'm feeling delirious But you know this is serious I'm sticking to you like glue Only see you now and then, but I know we could have it all Because before I was cynical, baby you were just cool  I just want to be around you Is that too much to ask? Don't tell I'm wrong, I could be there Don't tell I'm wrong, I could be there I just want to be around you Is that too much to ask? Don't tell I'm wrong, I could be there Don't tell I'm wrong I could be, I could be, I could be there If only you’d let me in, I could be there Just tell me where and tell me when So tired of these roads going nowhere But I know your love takes me somewhere You might also like Still looking up and down while you're being mysterious I see really big things for us We just need to break through, break through, break through Everything that you say, god I wish I had said it first And forgetting I had ever hurt Your love is pulling me through, me  through, me through  I just want to be around you Is that too much to ask? Don't tell I'm wrong, I could be there Don't tell I'm wrong, I could be there I just want to be around you Is that too much to ask? Don't tell I'm wrong, I could be there Don't tell I'm wrong  You are all I want So take me home The more you been thinking about us Open up, don't let me go The more you been thinking about  I just want to be around you Is that too much to ask? Don't tell I'm wrong, I could be there Don't tell I'm wrong, I could be there I just want to be around you Is that too much to ask? Don't tell I'm wrong, I could be there Don't tell I'm wrong I could be, I could be, I could be there If only you’d let me in, I could be there Just tell me where and tell me when So tired of these roads going nowhere But I know your love takes me somewhere6Embed",0.044,0.76,0.196,0.9958
14,14,Ellie Goulding,Halcyon (Deluxe Version),Atlantis,Jim Eliot & Ellie Goulding,"This is new, feels unused I've never met anyone like you Frightening, feeling naked Sense in searching something sacred  Ooh Ooh I'll forget you not I'll forget you not I'll forget you not I'll wait for you maybe  Where did you go? Where did you go? Where did you go? Where did you go? Where did you go? Where did you go? (I'll wait for you) Go, where did you go? Where did you go? Where did you go? Where did you go? Where did you go? (I'll wait for you)  I'm exhausted with lovin' No fight in me, I'm defeated I know I'm fooled, I can't help it You make my heart so helpless You might also like Oh, I'll forget you not I'll forget you not I'll look for you, for you maybe I'll forget you not I'll forget you not I'll wait for you maybe  Where did you go? Where did you go? Where did you go? Where did you go? Where did you go? Where did you go? (I'll wait for you) Go, where did you go? Where did you go? Where did you go? Where did you go? Where did you go? (I'll wait for you) Where did you go? Where did you go? Where did you go? Where did you go? Where did you go? Where did you go? (I'll wait for you) Go, where did you go? Where did you go? Where did you go? Where did you go? Where did you go? (I'll wait for you)6Embed",0.278,0.717,0.005,-0.9971
15,15,Ellie Goulding,,Bad Habit,," So many tears we've cried So much pain inside But, baby, it ain't over till it's over So many years we've tried To keep this love alive But, baby, it ain't over till it's over  How did we get so far from Everything we dreamed of? All the lies, all the lies We can't get over How did we get so far from Summer nights and those good times? All the lies, all the lies We can't get over  And maybe we're just each other's bad habits But that's what makes us fit, yeah (But, baby, it ain't over till it's over) And everybody's sayin' we got bad habits But we're far from perfect, but I miss it Oh, the way, the way, the way, the way we— You might also like Bad habit Bad habitEmbed",0.222,0.624,0.154,-0.8952
16,16,Ellie Goulding,Halcyon Days (Deluxe Digital Reissue),Beating Heart,Greg Kurstin,"Eyes make their peace in difficulties With wounded lips and salted cheeks And, finally, we step to leave To the departure lounge of disbelief  And I don't know where I'm going But I know it's gonna be a long time And I'll be leaving in the morning Come the white wine, bitter sunlight  Wanna hear your beating heart tonight Before the bleeding sun comes alive I want to make the best of what is left, hold tight And hear my beating heart one last time before daylight  In the canyon, underneath the trees Behind the dark sky, you looked at me I fell for you like autumn leaves Never faded, evergreen  And I don't know where I'm going But I know it's gonna be a long time 'Cause I'll be leaving in the morning Come the white wine, bitter sunlight You might also like Wanna hear your beating heart tonight Before the bleeding sun comes alive I want to make the best of what is left, hold tight And hear my beating heart one last time  I can't face this now, everything has changed I just wanna be by your side Here's hoping we collide Here's hoping we collide Here's hoping we collide  Wanna hear your beating heart tonight Before the bleeding sun comes alive I want to make the best of what is left, hold tight And hear my beating heart one last time  Wanna hear your beating heart tonight54Embed",0.166,0.661,0.173,0.6059
