,Unnamed: 0,Artist,Album,Song Title,Producer,Lyrics,neg,neu,pos,compound
133,133,Ellie Goulding,,Life Round Here (Ft. Angel Haze),Noah Beresin,"Part time love is the life round here We're never done Everything feels like touchdown on a rainy day  Now we're at square one And we wait too long Til' we’re at square one (x2) Part time love is the life round here We're never done Everything feels like touchdown on a rainy day  I wonder how you'd feel if you were lost in my mind Since you barely understand my thoughts sometimes Little bit of depth and a little bit of God Cause I swear that I be livin' in the dark sometimes And it sets in here, nobody gets let in 'Til I let my emotions out on every single page and instrumental I'm left with Shit, I wonder, will I ever really feel shit? And if it all takes time and I ask why, will time eventually reveal this? Cause... the remedy, I'm searchin' for the remedy Cause I'm fucked up and my heart's just another ghost of my memory Knock real hard on real real wood Things still feel bad when they real real good And my brain just a vessel and the knowledge suppose to heal But the more you fuckin' know, less things feel real Less things feel real, and the time shifts And my mind shifts and ain't really anyone or anything I can really vibe with Cause... I'm searchin', but I'm terrified That by the time I find what I'm lookin' for, I'll be dead inside You might also like Cause part time love is the life round here We're never done (We're never done)16Embed",0.115,0.81,0.075,-0.8584
134,134,Ellie Goulding,Bright Lights,Lights,Richard “Biff” Stannard & Ash Howes,"I had a way then Losing it all on my own I had a heart then But the queen has been overthrown And I'm not sleeping now The dark is too hard to beat And I'm not keeping now The strength I need to push me  You show the lights that stop me, turn to stone You shine it when I'm alone And so I tell myself that I'll be strong And dreaming when they're gone 'Cause they're calling, calling, calling me home Calling, calling, calling home You show the lights that stop me, turn to stone (Home) You shine it when I'm alone (Home)  Noises I play within my head Touch my own skin And hope that I'm still breathin' And I think back to when My brother and my sister slept In an unlocked place The only time I feel safe You might also like You show the lights that stop me, turn to stone You shine it when I'm alone And so I tell myself that I'll be strong And dreaming when they're gone 'Cause they're calling, calling, calling me home Calling, calling, calling home You show the lights that stop me, turn to stone (Home) You shine it when I'm alone (Home)  (Lights, lights, lights, lights) (Lights, lights, lights, lights) Home, home (Lights, lights, lights, lights) (Lights, lights)  You show the lights that stop me, turn to stone You shine it when I'm alone And so I tell myself that I'll be strong And dreaming when they're gone 'Cause they're calling, calling, calling me home Calling, calling, calling home You show the lights that stop me, turn to stone (Home) You shine it when I'm alone (Home) Home, home (Lights, lights, lights, lights) (Lights, lights, lights, lights) Home, home (Lights, lights, lights, lights) (Lights, lights, lights, lights)45Embed",0.135,0.773,0.092,-0.8225
135,135,Ellie Goulding,Divergent Spectrum,Lights (Bassnectar Remix),,"I had a heart then but the queen has been overthrown And I'm not sleeping now the dark is too hard to beat And I'm not keeping up the strength I need to push me You show the lights that stop me turn to stone You shine it when I'm alone And so I tell myself that I'll be strong And dreaming when they're gone Cause they're calling, calling, calling me home Calling, calling, calling home You show the lights that stop me turn to stone You shine them when I'm alone Home Noises, I play within my head Touch my own skin and hope that I'm still breathing And I think back to when my brother and my sister slept In an unlocked place the only time I feel safe You show the lights that stop me turn to stone You shine it when I'm alone And so I tell myself that I'll be strong And dreaming when they're gone You might also likeCause they're calling, calling, calling me home Calling, calling, calling home You show the lights that stop me turn to stone You shine them when I'm alone Home Light, lights, lights, lights Light, lights, lights, lights Light, lights, lights, lights Light, lights You show the lights that stop me turn to stone You shine it when I'm alone And so I tell myself that I'll be strong And dreaming when they're gone Cause they're calling, calling, calling me home Calling, calling, calling home You show the lights that stop me turn to stone You shine them when I'm alone Home, home Light, lights, lights, lights Light, lights, lights, lights Home, home Light, lights, lights, lights Light, lights, lights, lights Home, home Light, lights, lights, lights Light, lights, lights, lights Home, home Light, lights, lights, lights Light, lights, lights, lights1Embed",0.129,0.788,0.083,-0.8765
136,136,Ellie Goulding,"Lights (The Remixes, Pt. 2)",Lights (Captain Cuts remix),,"I had a heart then but the queen has been overthrown And I'm not sleeping now the dark is too hard to beat And I'm not keeping up the strength I need to push me You show the lights that stop me turn to stone You shine it when I'm alone And so I tell myself that I'll be strong And dreaming when they're gone 'Cause they're calling, calling, calling me home Calling, calling, calling home You show the lights that stop me turn to stone You shine them when I'm alone Home Noises, I play within my head Touch my own skin and hope that I'm still breathing And I think back to when my brother and my sister slept In an unlocked place the only time I feel safe You show the lights that stop me turn to stone You shine it when I'm alone And so I tell myself that I'll be strong And dreaming when they're gone You might also like'Cause they're calling, calling, calling me home Calling, calling, calling home You show the lights that stop me turn to stone You shine them when I'm alone Home Light, lights, lights, lights Light, lights, lights, lights Light, lights, lights, lights Light, lights You show the lights that stop me turn to stone You shine it when I'm alone And so I tell myself that I'll be strong And dreaming when they're gone 'Cause they're calling, calling, calling me home Calling, calling, calling home You show the lights that stop me turn to stone You shine them when I'm alone Home, home Light, lights, lights, lights Light, lights, lights, lights Home, home Light, lights, lights, lights Light, lights, lights, lights Home, home Light, lights, lights, lights Light, lights, lights, lights Home, home Light, lights, lights, lights Light, lights, lights, lightsEmbed",0.129,0.788,0.083,-0.8765
137,137,Ellie Goulding,"Lights (The Remixes, Pt. 2)",Lights (Drop Lamond remix),,"I had a heart then but the queen has been overthrown And I'm not sleeping now the dark is too hard to beat And I'm not keeping up the strength I need to push me You show the lights that stop me turn to stone You shine it when I'm alone And so I tell myself that I'll be strong And dreaming when they're gone 'Cause they're calling, calling, calling me home Calling, calling, calling home You show the lights that stop me turn to stone You shine them when I'm alone Home Noises, I play within my head Touch my own skin and hope that I'm still breathing And I think back to when my brother and my sister slept In an unlocked place the only time I feel safe You show the lights that stop me turn to stone You shine it when I'm alone And so I tell myself that I'll be strong And dreaming when they're gone You might also like'Cause they're calling, calling, calling me home Calling, calling, calling home You show the lights that stop me turn to stone You shine them when I'm alone Home Light, lights, lights, lights Light, lights, lights, lights Light, lights, lights, lights Light, lights You show the lights that stop me turn to stone You shine it when I'm alone And so I tell myself that I'll be strong And dreaming when they're gone 'Cause they're calling, calling, calling me home Calling, calling, calling home You show the lights that stop me turn to stone You shine them when I'm alone Home, home Light, lights, lights, lights Light, lights, lights, lights Home, home Light, lights, lights, lights Light, lights, lights, lights Home, home Light, lights, lights, lights Light, lights, lights, lights Home, home Light, lights, lights, lights Light, lights, lights, lightsEmbed",0.129,0.788,0.083,-0.8765
138,138,Ellie Goulding,Run Into the Light,Lights (Fear of Tigers Remix),Fear of Tigers & Ash Howes & Richard “Biff” Stannard,"I had a heart then but the queen has been overthrown And I'm not sleeping now the dark is too hard to beat And I'm not keeping up the strength I need to push me You show the lights that stop me turn to stone You shine it when I'm alone And so I tell myself that I'll be strong And dreaming when they're gone 'Cause they're calling, calling, calling me home Calling, calling, calling home You show the lights that stop me turn to stone You shine them when I'm alone Home Noises, I play within my head Touch my own skin and hope that I'm still breathing And I think back to when my brother and my sister slept In an unlocked place the only time I feel safe You show the lights that stop me turn to stone You shine it when I'm alone And so I tell myself that I'll be strong And dreaming when they're gone You might also like'Cause they're calling, calling, calling me home Calling, calling, calling home You show the lights that stop me turn to stone You shine them when I'm alone Home Light, lights, lights, lights Light, lights, lights, lights Light, lights, lights, lights Light, lights You show the lights that stop me turn to stone You shine it when I'm alone And so I tell myself that I'll be strong And dreaming when they're gone 'Cause they're calling, calling, calling me home Calling, calling, calling home You show the lights that stop me turn to stone You shine them when I'm alone Home, home Light, lights, lights, lights Light, lights, lights, lights Home, home Light, lights, lights, lights Light, lights, lights, lights Home, home Light, lights, lights, lights Light, lights, lights, lights Home, home Light, lights, lights, lights Light, lights, lights, lightsEmbed",0.129,0.788,0.083,-0.8765
139,139,Ellie Goulding,"Lights (The Remixes, Pt. 2)",Lights (Fernando Garibay remix),,"I had a heart then but the queen has been overthrown And I'm not sleeping now the dark is too hard to beat And I'm not keeping up the strength I need to push me You show the lights that stop me turn to stone You shine it when I'm alone And so I tell myself that I'll be strong And dreaming when they're gone 'Cause they're calling, calling, calling me home Calling, calling, calling home You show the lights that stop me turn to stone You shine them when I'm alone Home Noises, I play within my head Touch my own skin and hope that I'm still breathing And I think back to when my brother and my sister slept In an unlocked place the only time I feel safe You show the lights that stop me turn to stone You shine it when I'm alone And so I tell myself that I'll be strong And dreaming when they're gone You might also like'Cause they're calling, calling, calling me home Calling, calling, calling home You show the lights that stop me turn to stone You shine them when I'm alone Home Light, lights, lights, lights Light, lights, lights, lights Light, lights, lights, lights Light, lights You show the lights that stop me turn to stone You shine it when I'm alone And so I tell myself that I'll be strong And dreaming when they're gone 'Cause they're calling, calling, calling me home Calling, calling, calling home You show the lights that stop me turn to stone You shine them when I'm alone Home, home Light, lights, lights, lights Light, lights, lights, lights Home, home Light, lights, lights, lights Light, lights, lights, lights Home, home Light, lights, lights, lights Light, lights, lights, lights Home, home Light, lights, lights, lights Light, lights, lights, lightsEmbed",0.129,0.788,0.083,-0.8765
140,140,Ellie Goulding,,Lights - live at amoeba music,,"Losing it all on my own I had a heart then But the queen has been overthrown And I'm not sleeping now The dark is too hard to beat And I'm not keeping up The strength I need to push me You show the lights that stop me turn to stone You shine them when I'm alone And so I tell myself that I'll be strong And dreaming when they're gone 'Cause they're calling, calling, calling me home Calling, calling, calling home You show the lights that stop me turn to stone You shine them when I'm alone Noises, I play within my head Touch my own skin And hope they'll still be there And I think back to when My brother and my sister slept In another place The only time I feel safe You show the lights that stop me turn to stone You shine them when I'm alone And so I tell myself that I'll be strong And dreaming when they're gone 'Cause they're calling, calling, calling me home Calling, calling, calling home You show the lights that stop me turn to stone You shine them when I'm alone (Lights, lights, lights, lights, lights, lights) You show the lights that stop me turn to stone You shine them when I'm alone And so I tell myself that I'll be strong Dreaming when they're gone 'Cause they're calling, calling, calling me home Calling, calling, calling home You show the lights that stop me turn to stone You shine them when I'm alone Home, home (lights, lights, lights) Home, home (lights, lights, lights)You might also likeEmbed",0.15,0.758,0.092,-0.8968
141,141,Ellie Goulding,,Lights (Max Gordon remix),,"I had a heart then but the queen has been overthrown And I'm not sleeping now the dark is too hard to beat And I'm not keeping up the strength I need to push me You show the lights that stop me turn to stone You shine it when I'm alone And so I tell myself that I'll be strong And dreaming when they're gone 'Cause they're calling, calling, calling me home Calling, calling, calling home You show the lights that stop me turn to stone You shine them when I'm alone Home Noises, I play within my head Touch my own skin and hope that I'm still breathing And I think back to when my brother and my sister slept In an unlocked place the only time I feel safe You show the lights that stop me turn to stone You shine it when I'm alone And so I tell myself that I'll be strong And dreaming when they're gone You might also like'Cause they're calling, calling, calling me home Calling, calling, calling home You show the lights that stop me turn to stone You shine them when I'm alone Home Light, lights, lights, lights Light, lights, lights, lights Light, lights, lights, lights Light, lights You show the lights that stop me turn to stone You shine it when I'm alone And so I tell myself that I'll be strong And dreaming when they're gone 'Cause they're calling, calling, calling me home Calling, calling, calling home You show the lights that stop me turn to stone You shine them when I'm alone Home, home Light, lights, lights, lights Light, lights, lights, lights Home, home Light, lights, lights, lights Light, lights, lights, lights Home, home Light, lights, lights, lights Light, lights, lights, lights Home, home Light, lights, lights, lights Light, lights, lights, lightsEmbed",0.129,0.788,0.083,-0.8765
142,142,Ellie Goulding,"Lights (The Remixes, Pt. 2)",Lights (Ming remix),,"I had a heart then but the queen has been overthrown And I'm not sleeping now the dark is too hard to beat And I'm not keeping up the strength I need to push me You show the lights that stop me turn to stone You shine it when I'm alone And so I tell myself that I'll be strong And dreaming when they're gone 'Cause they're calling, calling, calling me home Calling, calling, calling home You show the lights that stop me turn to stone You shine them when I'm alone Home Noises, I play within my head Touch my own skin and hope that I'm still breathing And I think back to when my brother and my sister slept In an unlocked place the only time I feel safe You show the lights that stop me turn to stone You shine it when I'm alone And so I tell myself that I'll be strong And dreaming when they're gone You might also like'Cause they're calling, calling, calling me home Calling, calling, calling home You show the lights that stop me turn to stone You shine them when I'm alone Home Light, lights, lights, lights Light, lights, lights, lights Light, lights, lights, lights Light, lights You show the lights that stop me turn to stone You shine it when I'm alone And so I tell myself that I'll be strong And dreaming when they're gone 'Cause they're calling, calling, calling me home Calling, calling, calling home You show the lights that stop me turn to stone You shine them when I'm alone Home, home Light, lights, lights, lights Light, lights, lights, lights Home, home Light, lights, lights, lights Light, lights, lights, lights Home, home Light, lights, lights, lights Light, lights, lights, lights Home, home Light, lights, lights, lights Light, lights, lights, lightsEmbed",0.129,0.788,0.083,-0.8765
143,143,Ellie Goulding,,Lights (MK Charlee dub),,"I had a heart then but the queen has been overthrown And I'm not sleeping now the dark is too hard to beat And I'm not keeping up the strength I need to push me You show the lights that stop me turn to stone You shine it when I'm alone And so I tell myself that I'll be strong And dreaming when they're gone 'Cause they're calling, calling, calling me home Calling, calling, calling home You show the lights that stop me turn to stone You shine them when I'm alone Home Noises, I play within my head Touch my own skin and hope that I'm still breathing And I think back to when my brother and my sister slept In an unlocked place the only time I feel safe You show the lights that stop me turn to stone You shine it when I'm alone And so I tell myself that I'll be strong And dreaming when they're gone You might also like'Cause they're calling, calling, calling me home Calling, calling, calling home You show the lights that stop me turn to stone You shine them when I'm alone Home Light, lights, lights, lights Light, lights, lights, lights Light, lights, lights, lights Light, lights You show the lights that stop me turn to stone You shine it when I'm alone And so I tell myself that I'll be strong And dreaming when they're gone 'Cause they're calling, calling, calling me home Calling, calling, calling home You show the lights that stop me turn to stone You shine them when I'm alone Home, home Light, lights, lights, lights Light, lights, lights, lights Home, home Light, lights, lights, lights Light, lights, lights, lights Home, home Light, lights, lights, lights Light, lights, lights, lights Home, home Light, lights, lights, lights Light, lights, lights, lightsEmbed",0.129,0.788,0.083,-0.8765
144,144,Ellie Goulding,Lights,Lights (Original Version),Richard “Biff” Stannard & Ash Howes,"I had a way then, losin' it all on my own I had a heart then, but the queen has been overthrown And I'm not sleepin' now, the dark is too hard to beat And I'm not keepin' now the strength I need to push me  You show the lights that stop me, turn to stone You shine it when I'm alone And so I tell myself that I'll be strong And dreamin' when they're gone 'Cause they're callin', callin', callin' me home Callin', callin', callin' home You show the lights that stop me, turn to stone You shine it when I'm alone (Home)  Noises I play within my head Touch my own skin and hope that I'm still breathin' And I think back to when my brother and my sister slept In an unlocked place, the only time I feel safe  You show the lights that stop me, turn to stone You shine it when I'm alone And so I tell myself that I'll be strong And dreamin' when they're gone 'Cause they're callin', callin', callin' me home Callin', callin', callin' home You show the lights that stop me, turn to stone You shine it when I'm alone (Home) You might also like (Lights, lights, lights) (Lights, lights, lights, lights) (Lights, lights, lights) (Lights, lights)  You show the lights that stop me, turn to stone You shine it when I'm alone And so I tell myself that I'll be strong And dreamin' when they're gone 'Cause they're callin', callin', callin' me home Callin', callin', callin' home You show the lights that stop me, turn to stone You shine it when I'm alone (Home)  Home, home (Lights, lights, lights, lights) (Lights, lights, lights, lights) Home, home (Lights, lights, lights) (Lights, lights, lights, lights) Home, home (Lights, lights, lights) (Lights, lights, lights, lights) Home, home (Lights, lights, lights) (Lights, lights, lights, lights)Embed",0.126,0.784,0.09,-0.7783
145,145,Ellie Goulding,"Lights (The Remixes, Pt. 2)",Lights - rac mix,,"I had a heart then but the queen has been overthrown And I'm not sleeping now the dark is too hard to beat And I'm not keeping up the strength I need to push me You show the lights that stop me turn to stone You shine it when I'm alone And so I tell myself that I'll be strong And dreaming when they're gone 'Cause they're calling, calling, calling me home Calling, calling, calling home You show the lights that stop me turn to stone You shine them when I'm alone Noises, I play within my head Touch my own skin and hope that I'm still breathing And I think back to when my brother and my sister slept In an unlocked place the only time I feel safe You show the lights that stop me turn to stone You shine it when I'm alone And so I tell myself that I'll be strong And dreaming when they're gone 'Cause they're calling, calling, calling me home Calling, calling, calling home You show the lights that stop me turn to stone You shine them when I'm alone You might also likeYou show the lights that stop me turn to stone You shine it when I'm alone And so I tell myself that I'll be strong And dreaming when they're gone 'Cause they're calling, calling, calling me home Calling, calling, calling home You show the lights that stop me turn to stone You shine them when I'm alone Home, home Home, home Home, home Home, homeEmbed",0.15,0.754,0.096,-0.8765
146,146,Ellie Goulding,,Lights (remix by RAC),,"I had a heart then but the queen has been overthrown And I'm not sleeping now the dark is too hard to beat And I'm not keeping up the strength I need to push me You show the lights that stop me turn to stone You shine it when I'm alone And so I tell myself that I'll be strong And dreaming when they're gone 'Cause they're calling, calling, calling me home Calling, calling, calling home You show the lights that stop me turn to stone You shine them when I'm alone Home Noises, I play within my head Touch my own skin and hope that I'm still breathing And I think back to when my brother and my sister slept In an unlocked place the only time I feel safe You show the lights that stop me turn to stone You shine it when I'm alone And so I tell myself that I'll be strong And dreaming when they're gone You might also like'Cause they're calling, calling, calling me home Calling, calling, calling home You show the lights that stop me turn to stone You shine them when I'm alone Home Light, lights, lights, lights Light, lights, lights, lights Light, lights, lights, lights Light, lights You show the lights that stop me turn to stone You shine it when I'm alone And so I tell myself that I'll be strong And dreaming when they're gone 'Cause they're calling, calling, calling me home Calling, calling, calling home You show the lights that stop me turn to stone You shine them when I'm alone Home, home Light, lights, lights, lights Light, lights, lights, lights Home, home Light, lights, lights, lights Light, lights, lights, lights Home, home Light, lights, lights, lights Light, lights, lights, lights Home, home Light, lights, lights, lights Light, lights, lights, lights1Embed",0.129,0.788,0.083,-0.8765
147,147,Ellie Goulding,,Lights (Shook remix),,"I had a heart then but the queen has been overthrown And I'm not sleeping now the dark is too hard to beat And I'm not keeping up the strength I need to push me You show the lights that stop me turn to stone You shine it when I'm alone And so I tell myself that I'll be strong And dreaming when they're gone 'Cause they're calling, calling, calling me home Calling, calling, calling home You show the lights that stop me turn to stone You shine them when I'm alone Home Noises, I play within my head Touch my own skin and hope that I'm still breathing And I think back to when my brother and my sister slept In an unlocked place the only time I feel safe You show the lights that stop me turn to stone You shine it when I'm alone And so I tell myself that I'll be strong And dreaming when they're gone You might also like'Cause they're calling, calling, calling me home Calling, calling, calling home You show the lights that stop me turn to stone You shine them when I'm alone Home Light, lights, lights, lights Light, lights, lights, lights Light, lights, lights, lights Light, lights You show the lights that stop me turn to stone You shine it when I'm alone And so I tell myself that I'll be strong And dreaming when they're gone 'Cause they're calling, calling, calling me home Calling, calling, calling home You show the lights that stop me turn to stone You shine them when I'm alone Home, home Light, lights, lights, lights Light, lights, lights, lights Home, home Light, lights, lights, lights Light, lights, lights, lights Home, home Light, lights, lights, lights Light, lights, lights, lights Home, home Light, lights, lights, lights Light, lights, lights, lightsEmbed",0.129,0.788,0.083,-0.8765
