,Unnamed: 0,Artist,Album,Song Title,Producer,Lyrics,neg,neu,pos,compound
189,189,Ellie Goulding,Run Into the Light,Salt Skin (Alex Metric Remix),,"And you fit like a glove That is no way to live That is no way to love Full of fear in your skin And the weakness in giving in You're stabbed in the back But you feel no pain Push the heaviest doors That you can't open Yeah, they tied me up And my body lies still again You're as bright as the sun And as calm as the moon I don't know when you'll break But it's gonna be soon If my will caves in I'll be in the same boat as you I've got the salt skin Running to where he is Never going to give in Even with the strength He's stealing salt skin Telling me I'm winning Wars they created just to understand ""The meaning of"" You might also likeHands on strings And my mouth open Find the perfect words That I've not spoken And I won't tell the truth Unless you want me to For all of the times That I lost my head When it rolled to the floor And I found it again But when it came back No, I didn't know my own name I've got the salt skin Running to where he is Never going to give in Even with the strength He's stealing salt skin Telling me I'm winning Wars they created just to understand ""The meaning of"" I've got the salt skin Running to where he is Never going to give in Even with the strength He's stealing salt skin Telling me I'm winning Wars they created just to understand I've got the salt skin Running to where he is Never going to give in Even with the strength He's stealing salt skin Telling me I'm winning Wars they created just to understand ""The meaning of"" The meaningEmbed",0.188,0.642,0.169,-0.8564
190,190,Ellie Goulding,Delirium (Target Exclusive),Scream It Out,Greg Kurstin," I think I'll let fate just take me home Because over pain, love is outgrown I've never won a fight to understand I just move as my heart commands  I've always had a thing for silence But lately I just need a voice I recognise Baby, it's perfect timing now to...  Scream it out, out I won't let you down, down So scream it out, out I won't let you down, down  Have you found peace with your mistakes? Breathing on the glass as it breaks Have you found the words to save her And keep your heart out of danger?  I've always had a thing for silence But lately I just need a voice I recognise Baby, it's perfect timing now to.... You might also like Scream it out, out I won't let you down, down So scream it out, out I won't let you down, down  I've always had a thing for silence But lately I just need a voice I recognise Baby, it's perfect timing now to...  Scream it out, out I won't let you down, down So scream it out, out I won't let you down, down5Embed",0.162,0.693,0.145,-0.1424
191,191,Ellie Goulding,,Shark Eyes,,"There's a blue light outside the store The bell chimes with the sliding doors Got my shark eyes, so I won’t be long Leave your car outside with the engine on We pass the flowers and the magazines You're turning heads, oh, I guess we've caused a scene In the spotlight, but you wear it well I call you first prize, you can probably tell  But I ain’t waiting on the outside, looking for your invite Wonderin' how the rulеs might change the game I'll just say it outright, I knеw it the first night Everything from here's about to change  My love, you're the cold, cold call You're the nicotine hit, but you're just all talk My love, you're the London dream We were nothing at all, we were everything  Take the next left down the cul-de-sac If you get this one, then babe, I’ll hit you back Follow the porch light climbing up the steps I call you first prize ’cause I like you best You might also like But I ain't waiting on the outside, looking for your invite Wonderin’ how the rules might change the game I'll just say it outright, I knew it the first night Everything from here's about to change  My love, you're the cold, cold call You’re the nicotine hit, but you're just all talk My love, you're the London dream We were nothing at all, we were everything My love, you're the cold, cold call You're the nicotine hit, but you're just all talk My love, you're the London dream We were nothing at all, we were everything My love, you're the cold, cold call You're the nicotine hit, but you're just all talk My love, you're the London dream We were nothing at all, we were everything My love, you're the blue light switch You're the getaway car with the headlights dipped My love, you're the London dream We were nothing at all, we were everything  Ooh We were everything Ooh We were everythingEmbed",0.027,0.728,0.244,0.9983
192,192,Ellie Goulding,Brightest Blue (Digital Edition),Sixteen,Ian Kirkpatrick & Fred again.. & Mike Wise,"Do you remember when we moved out? My mum said, ""I love you, but it's a small house"" So we changed up and saved up Gave up our town We were dangerous, couldn't tame us What's missing now?  Time (Oh yeah, yeah, yeah) Suddenly, we got no time (Oh yeah, yeah, yeah) We're so busy doing life (Oh yeah, yeah, yeah) That I miss your eyes on mine, mine  If you just focus on me Like we were sixteen And plotting our lives Can I wear your t-shirt and sleep On you while I dream Of all the good times? When we were sixteen  Like we were sixteen Like we were sixteen You might also like Do you remember the teacher said ""You're too young, too stupid, don't lose your head"" But years gone and we held on with the best intent Just two kids who kicked it on MSN  Oh, time (Oh yeah, yeah, yeah) Suddenly, we got no time (Oh yeah, yeah, yeah) We're so busy doing life (Oh yeah, yeah, yeah) That I miss your eyes on mine, mine  Oh, if you just focus on me Like we were sixteen And plotting our lives (When we were plotting our lives) Can I wear your t-shirt and sleep (Oh) On you while I dream (Oh) Of all the good times? When we were sixteen  Like we were sixteen Oh, oh Like we were sixteen Let's take the love that we found And give it back to ourselves Sometimes, these things don't work out Sometimes, there'll be no one else They said we'd never even make it this far But here we are And we're still counting stars Like we were sixteen  Oh, when we were sixteen Oh, oh We're still counting stars like we were sixteen We're still counting stars like we were sixteen6Embed",0.06,0.644,0.296,0.9982
193,193,Ellie Goulding,,Sixteen (99 Souls Remix),99 Souls,"Do you, do you, do you remember when we moved out? My mum said, ""I love you, but it's a small house"" So we changed up and saved up Gave up our town We were dangerous, couldn't tame us What's missing now?  Time Suddenly, we got no time We're so busy doing life That I miss your eyes on mine, mine  If you just focus on me Like we were sixteen And plotting our lives Can I wear your t-shirt And sleep on you While I dream of all the good times? (All the good time) When we were sixteen  Like we were sixteen Like we were sixteen We were sixteen, we were sixteen You might also like Do you remember the teacher said ""You're too young, too stupid, don't lose your head"" But years gone and we held on with the best intent Just two kids who kicked it on MSN  Oh, time Suddenly, we got no time We're so busy doing life That I miss your eyes on mine, mine  Oh, if you just focus on me Like we were sixteen And planning our lives (When we were planning our lives) Can I wear your t-shirt And sleep on you While I dream of all the good times? (All the good times) When we were sixteen  Like we were sixteen Like we were sixteen Like we were sixteen Like we were sixteen They said we'd never even make it, make it this far But here we are And we're still counting stars Like we were sixteen They said we'd never even make it this far But here we are And we're still counting stars Like we were sixteen  Oh, if you just focus on me Like we were sixteen And planning our lives (When we were planning our lives) Can I wear your t-shirt And sleep on you While I dream of all the good times? (All the good times) When we were sixteen  Like we were sixteen Like we were sixteen Like we were sixteenEmbed",0.051,0.718,0.231,0.9973
194,194,Ellie Goulding,,Sixteen (Acoustic),,"Do you remember when we moved out? My mum said, ""I love you, but it's a small house"" So we changed up and saved up Gave up our town We were dangerous, couldn't tame us What's missing now?  Time Suddenly, we got no time We're so busy doing life That I miss your eyes on mine, mine  If you just focus on me Like we were sixteen And planning our lives Can I wear your t-shirt And sleep on you While I dream of all the good times? When we were sixteen  Oh, when we were sixteen Oh, when we were sixteen Yeah, when we were sixteen You might also like Do you remember the teacher said ""You're too young, too stupid, don't lose your head""? But years gone and we held on with the best intent Just two kids who kicked it on MSN  Oh, time Suddenly, we got no time And we're so busy doing life That I miss your eyes on mine, mine  Oh, if you just focus on me Like we were sixteen And plotting our lives Oh, can I wear your t-shirt And sleep on you While I dream of all the good times? When we were sixteen  Oh, yeah, when we were sixteen Oh, when we were sixteen Yeah, when we were sixteen Let's take the love that we found And give it back to ourselves Sometimes these things don't work out Sometimes there'll be no one else They said we'd never even make it this far But here we are And we're still counting stars Like we were sixteen  Like we were sixteen Like we were sixteen Oh, when we were sixteen Like we were sixteenEmbed",0.071,0.737,0.192,0.9917
195,195,Ellie Goulding,,Sixteen (Don Diablo Remix),Don Diablo,"You and me at sixteen You and me at sixteen Oh yeah, yeah, yeah, yeah  Do you remember when we moved out? My mum said, ""I love you, but it's a small house"" So we changed up and saved up Gave up our town We were dangerous, couldn't tame us What's missing now?  Time (Oh yeah, yeah, yeah, yeah) Suddenly, we got no time (Oh yeah, yeah, yeah, yeah) We're so busy doing life (Oh yeah, yeah, yeah, yeah) That I miss your eyes on mine, mine  If you just focus on me Like we were sixteen And plotting our lives Can I wear your t-shirt And sleep on you While I dream of all the good times? When we were sixteen You might also like We were sixteen We were sixteen We were sixteen We were sixteen We were sixteen We were sixteen We were sixteen Like we were sixteen We were sixteen We were sixteen We were sixteen We were sixteen We were sixteen We were sixteen   We were sixteen Oh yeah, yeah, yeah, yeah Oh yeah, yeah, yeah Oh yeah, yeah, yeah, yeah Oh yeah, yeah, yeah Oh yeah, yeah, yeah, yeah Oh yeah, yeah, yeah Oh, time (Oh yeah, yeah, yeah, yeah) Suddenly, we got no time (Oh yeah, yeah, yeah, yeah) We're so busy doing life (Oh yeah, yeah, yeah, yeah) That I miss your eyes on mine, mine  Oh, if you just focus on me Like we were sixteen And plotting our lives Can I wear your t-shirt And sleep on you While I dream of all the good times? When we were sixteen  We were sixteen We were sixteen We were sixteen We were sixteen We were sixteen We were sixteen We were sixteen Like we were sixteen We were sixteen We were sixteen We were sixteen We were sixteen We were sixteen We were sixteen  We were sixteen Oh yeah, yeah, yeah, yeah Oh yeah, yeah, yeah Oh yeah, yeah, yeah, yeah Oh yeah, yeah, yeah Oh yeah, yeah, yeah, yeah Oh yeah, yeah, yeah  Oh yeah, yeah, yeah, yeah Oh yeah, yeah, yeah Oh yeah, yeah, yeah, yeah Oh yeah, yeah, yeah Oh yeah, yeah, yeah, yeah Oh yeah, yeah, yeahEmbed",0.03,0.46,0.51,0.9997
196,196,Ellie Goulding,,Sleeping Alone,,"Givin' the time to cut the rope You tie the  around me Lookin' for other hands to hold But nothing ever goes deep I'm seein' your face, I'm hearin' your name Everywhere I go I'm not the only one to blame 'Cause I gave you more than I took  I heard your song on the radio yesterday Stopped the car and turned around In my head, still with you now  Are you sleeping alone? Are you sleeping alone? 'Cause I'm not ready, not ready To be sleeping on my own So, are you sleeping alone? Are you sleeping alone? 'Cause I'm not ready, not ready To be sleeping on my own I'm pickin' up the phone But every time I got a lump But every time I got a lump In my throat, my throat Are you sleeping alone? Are you sleeping alone? 'Cause I'm not ready, not ready To be sleeping on my own You might also like Gonna clear my mind But I can only think of you I know it's not my place But does she know you like I do? I need you to be honest So I keep movin' on Maybe if I know she's there Swear I'm movin' on  I heard your song on the radio yesterday Stopped the car and turned around In my head, still with you now  Are you sleeping alone? Are you sleeping alone? 'Cause I'm not ready, not ready To be sleeping on my own So, are you sleeping alone? Are you sleeping alone? 'Cause I'm not ready, not ready To be sleeping on my own I'm pickin' up the phone But every time I got a lump But every time I got a lump In my throat, my throat Are you sleeping alone? Are you sleeping alone? 'Cause I'm not ready, not ready To be sleeping on my own Can't have you sleeping Sleeping alone I never want you sleeping Sleeping alone Can't have you sleeping Sleeping alone I never want you sleeping Sleeping alone Can't have you sleeping Sleeping alone I never want you sleeping Sleeping alone Can't have you sleeping Sleeping alone I never want you sleeping Sleeping alone  Are you sleeping alone? Are you sleeping alone? 'Cause I'm not ready, not ready To be sleeping on my own So, are you sleeping alone? Are you sleeping alone? 'Cause I'm not ready, not ready To be sleeping on my own I'm pickin' up the phone But every time I got a lump But every time I got a lump In my throat, my throat Are you sleeping alone? Are you sleeping alone? 'Cause I'm not ready, not ready To be sleeping on my own Can't have you sleeping Sleeping alone I never want you sleeping Sleeping alone Can't have you sleeping Sleeping alone I never want you sleeping Sleeping aloneEmbed",0.261,0.712,0.027,-0.9985
197,197,Ellie Goulding,,Slow Down,,Nothing changes That’s all I ever wanted Wishing you were closer But there is so much in between This feels different With you I’ve never been so sure You reel me in I’d never been that far before That’s what I found That’s what I found That’s what I found  These days slow down Nothing but air and oceans between us Weighing me down I wish that we had nothing in common Then there would be no distance to dwell on  I am waiting but what good is another day I’ve got too much time But never time enough to say You’re all I wanted You are all I wanted You’re all I found You’re what I found You might also like  You give me all The time that you have But you’re still away In no way I'm glad 'cause I’ve got more time So I can work out All the places we’ll go And what we’ll talk about Oh when you’re back   I wish that we had nothing in common Then there would be no distance to dwell on”Embed,0.043,0.791,0.166,0.9721
198,198,Ellie Goulding,,Slow Grenade (Solo Version),OZGO & Joe Kearns,"Help me, my God, this got messy Least I got the best seat 'Cause we put on one hell of a show Waiting, I just keep on waiting For the final curtain 'Cause I just can't let go of your love  Ooh You say my name like you know my dark side, ooh Can't beat the taste of the tears that I'll cry, ooh  Slow grenade is blowing up My mistakes, so why don't I Why don't I stop it? Still got time for me to stop it It's like a part of me must want it That's why I'm not running from it Can't escape this blowing up In my face, so why can't I Why can't I stop it? Still got time for me to stop it It's like a part of me must love it That's why I'm not running from it You might also like Dangerous, it's time to stop this circus We hurt ourselves on purpose And I don't wanna walk on a wire, no Blame me, blame you while you blame me You said you'd never change me But I still change my hair for you though  Ooh You say my name like you know my dark side, ooh Can't beat the taste of the tears that I'll cry, ooh  Slow grenade is blowing up My mistakes, so why don't I Why don't I stop it? Still got time for me to stop it It's like a part of me must want it That's why I'm not running from it Can't escape this blowing up In my face, so why can't I Why can't I stop it? Still got time for me to stop it It's like a part of me must love it That's why I'm not running from it Help me, my God, this got messy Least I got the best seat 'Cause we put on one hell of a show  Oh, slow grenade is blowing up My mistakes, so why don't I Why don't I stop it? Still got time for me to stop it It's like a part of me must want it That's why I'm not running from it Can't escape this blowing up In my face, so why can't I Why can't I stop it? Still got time for me to stop it It's like a part of me must love it That's why I'm not running from itEmbed",0.166,0.704,0.13,-0.4198
199,199,Ellie Goulding,,Soho square - live at shepherd's bush empire 2010,,"An empty bench in Soho Square Forgotten now I turn away Just save me for a rainy day But don't be sorry, I don't want to hear it baby My feet froze in the winter chill I knew I'd probably get ill But I was praying we could fill an empty bench and still You're so sorry but I don't want your pity baby It's all yours now please don't tease The pigeons shiver in the naked trees And I'll do anything but please don't hurt me Just kiss me quick 'cos it's my birthday And I feel so small I don't know why but no I'm not too old to cry An empty bench in Soho Square If you'd have come you'd have found me there But you never did 'cos you don't care and I'm so sorry baby I don't mind loneliness too much but when I met you I was touched And that was good enough for me but do we always have to be sorry Why can't we just be happy baby? One day you'll be waiting there, no empty bench in Soho Square And we'll dance around like we don't care And I'll be much too old to cry And you'll kiss me quick in case I die before my birthday You might also likeOne day you'll be waiting there, no empty bench in Soho Square No I don't know the reason why I'll love you till the day I die But one day you'll be waiting there Come summertime in Soho Square And I'll be painting stars up in the sky Before I get too old to cry before my birthday I hope I see those pigeons fly before my birthday In Soho Square on my birthdayEmbed",0.205,0.631,0.164,-0.9364
200,200,Ellie Goulding,Delirium (Target Exclusive),Something in the Way You Move,Greg Kurstin,"It's the strangest feeling Feeling this way for you There's something in the way you move Something in the way you move With you I’m never healing It’s heartache through and through There's something in the way you move I don’t know what it is you do Not one bone in your body good enough for me But this heart is open, bloodstain on my sleeve When our eyes meet, I can only see the end But tonight I'm here, yours again  But tonight I'm gonna lose it all Playing with fire, I was the first to fall Heart is sinking like a cannonball Baby, kill it, what you waiting for?  Something in the way you move There's something in the way you do it Something in the way you move Oh There's something in the way you move Something in the way you do it Something in the way you move Oh Oh-oh-oh-oh-oh-oh-oh Oh-oh-oh-oh-oh You might also like There's an evil night air, the stars don't shine tonight, (night) There's something in the way you do There's something in the way you Push me closer, further Break me just enough Your lies always seem so true There's nothing  left for me to lose There's not one thing I can do to change your ways But I can't sit back and take the lonely days When our eyes meet, I can only see the end And tonight the rain pours again  But tonight I'm gonna lose it all Playing with fire, I was the first to fall Heart is sinking like a cannonball Baby, kill it, what you waiting for?  Something in the way you move There's something in the way you do it Something in the way you move Oh There's something in the way you move Something in the way you do it Something in the way you move Oh Oh-oh-oh-oh-oh-oh-oh Oh-oh-oh-oh-oh-oh-oh Oh-oh-oh-oh-oh Oh-oh-oh-oh-oh  But tonight I'm gonna lose it all Playing with fire, I was the first to fall Heart is sinking like a cannonball Baby, kill it, what you waiting for?  Something in the way you move There's something in the way you do it Something in the way you move Oh There's something in the way you move Something in the way you do it Something in the way you move Oh19Embed",0.129,0.804,0.066,-0.9888
201,201,Ellie Goulding,,Song Covers,,"""Black & Gold"" - Sam Sparro ""The Cave"" - Mumford and Sons ""Don't Panic"" - Coldplay ""Hanging On"" - Active Child ""Heartbeats"" - The Knife ""High For This"" - The Weeknd ""Jolene"" - Dolly Parton ""Life Round Here"" - James Blake ""Mirrors"" - Justin Timberlake ""Only Girl In The World"" - Rihanna ""Roscoe"" - Midlake ""Some Nights"" - Fun You might also like""Sweet Disposition"" - The Temper Trap ""Tessellate"" - Alt-J ""The Wolves"" - Bon Iver ""Your Song"" - Elton John3Embed",0.07,0.81,0.12,0.5577
202,202,Ellie Goulding,Lights,Starry Eyed,Starsmith,"Oh, oh, starry-eyed Hip, oh, oh, sta-a-a-a Oh, oh,   S-Starry-eyed Hit, hit, hit, hit, hit me with lightning  Handlebars that I let go, let go for anyone Take me in and I'll throw out my heart and get a new one  Next thing, we're touching You look at me, it's like you hit me with lightning, ah-ah  Oh, everybody's starry-eyed And everybody glows Oh, everybody's starry-eyed And my body goes woah-oh-oh Ah, ah, woah-oh-oh Ah, ah, woah-oh-oh  So we burst into colours, colours and carousels Fall head first like paper planes and playground games You might also like Next thing, we're touching You look at me, it's like you hit me with lightning  Oh, everybody's starry-eyed (Sta-a-a-a-a-a-ar) And everybody glows Oh, everybody's starry-eyed And my body goes woah-oh-oh (Oh-woah-woah-woah-woah) Ah, ah, woah-oh-oh Ah, ah, woah-oh-oh (Oh-woah-woah-woah-woah) Sta-a-a-ar  Next thing we're touching (Oh, woah, woah) Next thing we're touching (, and I let go) Next thing we're touching (Oh, woah, woah) Next thing we're touching (We come and go but we're not in love, in love) Next thing we're touching (Oh, woah, woah) Next thing we're touching (We come and we go but we're not in love, and I let go) Next thing we're touching Next thing we're touchi-i-ing Hit me with lightning  Oh, everybody's starry-eyed And everybody glows Oh, everybody's starry-eyed And my body goes Oh, everybody's starry-eyed (Everybody's starry-eyed) And everybody glows Oh, everybody's starry-eyed (Oh everybody, woah-oh) And my body goes, woah-oh-oh (Oh, ooh, woah-woah-woah) Ah, ah, woah-oh-oh (Woah, woah, where my body goes?) Ah, ah, woah-oh-oh Ah-ooh-ooh-ooh9Embed",0.058,0.916,0.026,-0.911
203,203,Ellie Goulding,Starry Eyed (Remixes),Starry Eyed (AN21 & Max Vangeli Remix),AN21 & Max Vangeli & Starsmith,"Hit, hit, hit, hit, hit me with lightning Handle bars, and then I let go, let go for anyone Take me in, and throw out my heart and get a new one Next thing, we're touching You look at me, it's like you hit me with lightning Oh, everybody's starry eyed And everybody knows Oh, everybody's starry eyed And my body goes So we burst into colors, colors and carousels Fall head first, like paper planes and playground games Next thing, we're touching You look at me, it's like you hit me with lightning Oh, everybody's starry eyed And everybody knows Oh, everybody's starry eyed And my body goes Next thing, we're touching Next thing, we're touching Next thing, we're touching Next thing, we're touching Next thing, we're touching Next thing, we're touching Next thing, we're touching Next thing, we're touching You might also likeHit me with lightning Oh, everybody's starry eyed And everybody knows Oh, everybody's starry eyed And my body goes Oh, everybody's starry eyed And everybody knows Oh, everybody's starry eyed And my body goesEmbed",0.0,0.958,0.042,0.7579
204,204,Ellie Goulding,Starry Eyed (Remixes),Starry Eyed (Jakwob Remix),Jakwob & Starsmith,"Hit, hit, hit, hit, hit me with lightning Handle bars, and then I let go, let go for anyone Take me in, and throw out my heart and get a new one Next thing, we're touching You look at me, it's like you hit me with lightning Oh, everybody's starry eyed And everybody knows Oh, everybody's starry eyed And my body goes So we burst into colors, colors and carousels Fall head first, like paper planes and playground games Next thing, we're touching You look at me, it's like you hit me with lightning Oh, everybody's starry eyed And everybody knows Oh, everybody's starry eyed And my body goes Next thing, we're touching Next thing, we're touching Next thing, we're touching Next thing, we're touching Next thing, we're touching Next thing, we're touching Next thing, we're touching Next thing, we're touching You might also likeHit me with lightning Oh, everybody's starry eyed And everybody knows Oh, everybody's starry eyed And my body goes Oh, everybody's starry eyed And everybody knows Oh, everybody's starry eyed And my body goesEmbed",0.0,0.958,0.042,0.7579
