,Unnamed: 0,Artist,Album,Song Title,Producer,Lyrics,neg,neu,pos,compound
71,71,Kid Cudi,,Did You Get It,,"I will say it now so you all can say it properly Even for awhile lotta people stayed mocking me Then I went G.O.O.D. cause of 'ye now they jocking me I have the same sound, same old fire, same lion heart And I stayed smoking sour, every single minute now, gotta say an hour I feel I am cross of John Lennon and my father I remember when I finally left Cleveland Being cool, it wasn't the only reason My heart had urges, the feelings Something special you could feel up in the evening When the moons full and the drink is poured And most of the real pretty girls are whores Now I gotta say get the fuck outta here, I don't know you No, you can't chill in here Na na na na Yeah yeah yeah Now Do you, do you, do you Do you get it, get it Na na na na Whoa.. na na Now Do you, do you, do you Do you get it, get it You might also likeMy last name Mescudi, first name Scott I was the kid you knew who liked to joke and clown a lot But when I went home school work to the side I'mma go and study how to finish up these rhymes Maybe hit a kidney and my family hit the grind Before I feel I'll never ever find my own mind Losing my pops really fucked me up At that time in my mind I thought my luck was up Its mostly cause I never got to show what I dream I guess its cause I never had the time to let it show But now I got an op im bout to give to the public I know he lookin' down, I know he gotta love it Ohio got a spokesman They wanna know if I really smoke Come on fam Are you lookin at these black lips? All the time im flatlined stoned bitch Na na na na Yea yea yea Now Do you, do you, do you Do you get it, get it Na na na na Whoa.. na na Now Do you, do you, do you Do you get it (Yea) , get it I'm scott mescudi Never let the sucker motha' fuckers get the best of me Goin back to Cleveland, dap and pound her is my ? Stand up nigga When people hate on Cleveland I stand up nigga WOW in my A.P.C AA get the best plain tees When I head to the grammys I might dress tacky Cause all the people care about is what im wearing In the bag it should be about the sweet fuckin album Lets talk about the fact you want a sweet fuckin album Some talk shit makin' videos and jokin Now your all fans of my shaft think I stroke em I told you, I was not playin' From here on believe the words that im sayin' But know I won't lead you astray Just take heed to the words that I say Na na na na Yea yea yea Now Do you, do you, do you Do you get it, get it Na na na na Whoa.. na na Now Do you, do you, do you Do you get it , get it2Embed",0.072,0.82,0.108,0.9466
72,72,Kid Cudi,"Passion, Pain & Demon Slayin’",Distant Fantasies,Plain Pat & Kid Cudi,"Hey-ey-ey-ey-ey, uh Hey-ey-ey-ey-ey, uh You fronting for that new nigga and, and we know it, hmmm You keep fronting for that new nigga and- and we know it You blew it  Uh, I know you still think about me I could tell he knows, he probably saudy No more dodging this shit, the cat and mouse Finding love in the shadows, ready to pounce They yearning for my return Laying next to him, you daydreaming of my meat You remember when I said, ""Put it on my face""? Damn, girl, when will you learn? There's no escaping me Passion never dissipates, no soul without your mate, relate Man, I could've never fathomed Hate you mingling with these corny niggas, though I don't care how it happened It's cool now, 'cause I'm home Sloppiest sex, the best way, we're both giving dome Uh-uh, until the break of dawn I gotta, getcha, getcha, getcha on, on You know I'm the only one to get you revved up Spread it open, pound it 'til it's numb, yum In bed you would play a vision that's too thotty Like, what's on your mind, babe? One blink and you're caught lying You might also like Lying, lying entirely to everyone Distant yearnings and fantasies Keep lying, you keep lying entirely to everyone There isn't another soul who knows your soul Like I, quite like I, quite like I, quite like I Yeah, quite like I, quite like I (Quite like...)  ""I'm so through with him,"" she says ""I hate her,"" he says The makeup sex is electric He smiles her gazes Her sun on gray weeks Translates her heartbeat ""My leg's shakin',"" she says He grabs the back of her neck And they live a little, mmm And they live a little Give a little  Lying, lying entirely to everyone Distant yearnings and fantasies Keep lying, you keep lying entirely to everyone There isn't another soul who knows your soul Like I, quite like I, quite like I, quite like I You fronting for that new nigga and, and we know it Hmmm, hmmm-mmm-mmm-mmm  The curse of once dating an awesome nigga Can't duck my energy, ever Such a curse is a curse if you make it so Which means we in control until forever So stop wasting your fucking chi Stop searching, chasing your tail Running in circles to no destination Remember we once saved each other from hell? I'm never tryna persuade You gotta figure what you want in you I'll be clear, I'm a hell of a man Flaws and all, somebody would love to have me, too But you can tell I'm bored with these hoes Sex is weak when there isn't a glow Takes a man longer to see this fact Women are quicker with this type of shit, we know Uh, uh, show me the lane, dude I'll be speeding down that bitch, I'm going straight to you Uh, always knew you still thought about me Now cut the doubt Lying, lying entirely to everyone Distant yearnings and fantasies Keep lying, you keep lying entirely to every one There isn't another soul who knows your soul Like I, quite like I, quite like I, quite like I Yeah, quite like I, quite like I (Quite like...)11Embed",0.169,0.697,0.134,-0.9842
73,73,Kid Cudi,Man on the Moon III: The Chosen,Dive,Kid Cudi & Dot Da Genius & Anthony Kilhoffer & Aaron Bow & Teddy Walton,"Hey  Seen nothing like that shorty with the fat back movin' to the vibes (Vibes) Say, ""I'm just up in my habitat, playin' little Ratatat, kickin' with my tribe"" (Ride) I'm sayin' it's a known fact, show 'em, nigga, no act, sucker, fall in line (Yeah) I'm out to get mine, woah, woah, niggas seein' me shine (Ride) Catch me baked outside, wonderin' daily, why, why? Will she let me get behind? Baby, just close your eyes (Eyes) You see we takin' off, leave the stress, no time (Bye) This ain't televised, see I'm her surprise, I  Ooh-ooh, ooh, that vibe Ooh-ooh, ooh, that vibe Ooh-ooh, I need those fuckin' vibes Doo-doo-doo-doo, and we ragin' 'til daylight Things are gettin' gnarly, got my whiskey by my side Soarin' through my world and I'm 'bout to take a dive This is just the sadness in me, sad times Just another evening and I'm leanin', oh (Let's get it)  Uh, ready, go, set, we won't hold you, neither (Uh) Salute when you see that nigga (Yeah) Tell him, ""Go off,"" when you see him, greet him (Mm) Talkin' shit, fuck ya, legend of the cold one, nice This my life, all my nights Walkin' like a disco ball, all this ice, aye Ayy, ayy, ayy, ayy (This the story) Ayy, ayy, ayy (Woo), ayy (Of a man) Ayy, ayy, ayy (Woo), ayy (And you know it) Ayy, ayy, ayy (Move, move), ayy (Catch the show) Slightly paranoid, can't believe 'em simply (Yeah) Nah, bullshit, miss me (Nah, nah), ahh Call it what it is then, lies This my fantasy high, sayin' goodbye I lay at night, it intensifiesYou might also like23Embed",0.146,0.782,0.072,-0.9591
74,74,Kid Cudi,"Passion, Pain & Demon Slayin’",Does It,Kid Cudi & Anthony Kilhoffer & Idle Kid,"You can depend on Cud Life to kill it Having guillotine dreams with my enemies, oh See 'em in the ditch, see 'em out, hit the exit Can't stand to hear a bitch nigga mouth I took a hook in the road to get in the mode, geronimo Get in my jeans, white tee, and clean fitted Hoes know me 'round the map, I can't hide the old summers Hit the fuse and I lit it, the rest unfolds Tell me how the fuck does he does it? Levels unreachable, can't pin him to a mold It's like a nigga been here before Shit is a bore, my thoughts soar in the AM Slay them like a machine round the clock With the 12 gauge aim, telling Satan to fuck off Hated the hand I was given Tossed that shit back, like God must be kidding And not for a nigga like me, not for the family Not with a similar plans I just dumped And I made me some choices, heard voices follow No, can't stop a man with passion These hoes don't distract a god, I am no clown Grown man laying the stones all around in my throne My kingdom, throwing from space Fuck off expression on face, this is the case I'm in place to be great, hmm No fakes, raising the stakes I'm in place to be great, hmm, hmm, hmm You might also like Uh, doing music, TV and movies Sitting on the floors we ain't heard of And the media wanna act like I ain't out here (I'm out here) Running laps around these hoes (for years) Running the game with no cheat codes (uh) Unfuckwittable with two T's nigga, who else but Cud? Give a motherfuck  I does it, I, I, I does it and, I does it, yeah I, I, I does it yeah, I, I does it yeah, oh, oh, oh Nigga, I does it, yeah, oh, I, nigga, I does it, yeah Oh, oh, oh, I does it, yeah, I does it, yeah, oh, oh  Thought the kid dough cause I'm in a oven often The kush in the lungs, a bushel of nugs Awaken the dope, but they never dissolve the coke Got the homies in the hood and they wanna rage on Fast lane, pushing to the limit Uh, enjoy the spoils, but don't bask in it But see, I really wanna get me a farm and grow crop Live with some girls who love me and this cock The more I grow, the more I double in powers Non-ambitious for cowards, trippy go for toe Won't be a drone clone, half-hearted Sheep in the herd, brainwashed at what cost I'm a raise some hell, you know this And if I piss people off along the way, bonus Cause these niggas are stale chips All around thinking they're fresh with the stale shit And corny bitches need corny niggas, that's well fit God has a plan for everybody but I'm it, Chosen Scotty 'bout to even the mood, get lost in the tune Forget it all, take flight my doves Say we are the, we are the knights in the world Listen baby can you see in the club, we gettin' bent up The sun up, egg, cheese, sunny-side up I'm waiting for you, and taking the cue Having a drink, let's make it a few Here's to you, you, you, and you Salute, hmmm, I bid you adieu Salute Uh, doing music, TV and movies Sitting on the floors we ain't heard of Uh, and the media wanna act like I ain't out here (I'm out here) Running laps around these hoes Winning the game, no cheat codes Unfuckwittable with two T's nigga, who else but Cud? Give a motherfuck  I does it, I, I, I does it and, I does it yeah I, I, I does it yeah, I, I does it yeah, oh, oh, oh Nigga, I does it yeah, oh, I, nigga I does it yeah Oh, oh, oh, I does it yeah, I does it yeah, oh, oh13Embed",0.109,0.748,0.143,0.957
75,75,Kid Cudi,Man on the Moon II: The Legend of Mr. Rager,Don't Play This Song (Ft. Mary J. Blige),Emile Haynie,"Hey, let's have some fun this time  Wanna know what it sound like when I'm not on drugs? Please, please don't play this song R-r-r-r-right, r-right, r-right, right, right Trying to get my mind, my mind, my mind, right, right People think they really being helpful By telling me please be careful, yeah right R-r-right, r-right, right, right Please, please don't play this song Yeah, haha  Pain, hurt, sadness, and loneliness Balled all that shit right up Tossed it away to the bottomless pit The part of my mind that slips And the part of my mind so sick I don't even like to take the trip unless I'm sloppy drunk I pray for my mom, how a teach had a son That never gave a fuck about a scantron? All I wanted was to be a human being And show all the world some new colors and scenes Imagine all types of beautiful scenery I remember when I first had trees Smoked out a Black and Mild, so dumb of me Now, I'm grape Cigarillo man Any young black kid, guaranteed fan Hold it down, humble pie on the humble And I treat normal girls like models Reckless and young, and my, my mom's calling Think I should hit decline I'm numb faced while I'm thinking 'bout suicide You might also like Wanna know what it sound like when I'm not on drugs? Please, please don't play this song (Please don't play this song) R-r-r-r-right, r-right, r-right, right, right (Right) Trying to get my mind, my mind, my mind, right, right People think they really being helpful By telling me please be careful, yeah right R-r-right, r-right, right, right (Hey, whoa) Please, please don't play this song (Yeah, hey)  Black Robin Hood, riding high just like we should You know the saying, ain't no delaying Gotta gets the getting while the getting's good Yeah, demented, my brain was forced to transform Wise up, I'm checking the gate On humble tales and minimum wage The blogs tell it, ""Cudi's lame Wearing a kilt? He must be gay"" Let's keep it trill, fuck being discreet But some girls tweet how they miss my meat Yeah, Cudders; HBO, that Vitamin Water That's money to blow 'cause it's money for blow Don't take no shit, you can blame my ma I'm in the maze, I'm in a daze, I'm losing it I'm locking in my rocketship I'll be a blip on your radar, bitch Feels like things can be covered Until the day I'm above myself, hovered Wanna know what it sound like when I'm not on drugs? Please, please don't play this song R-r-r-r-right, r-right, r-right, right, right (—ight) Trying to get my mind, my mind, my mind, right, right People think they really being helpful By telling me please be careful, yeah right (Me) R-r-right, r-right, r-right, right, right (They thinking 'bout me) Please, please don't play this song, aha  Mmm (Ooh-ooh) Yeah (Ooh) Yeah (Ooh) Mmm (I say ooh-ooh, ooh-ooh, ah) Mmm (Ooh-ooh, ooh-ooh, ah) Mmm31Embed",0.161,0.709,0.13,-0.9435
76,76,Kid Cudi,,Dose of Dopeness,Dot Da Genius,"Uh, oh-oh-oh Yeah Uh, oh-oh-oh-oh-oh Yeah Uh, oh-oh-oh (Headbanger)  Movin' wit out movin', Pure crush groovin' Right on track, right on and I'm back Rap Ex-Lax yeah, I be pooin' on ‘em Damn right, Mr. Cudi he be dippin' on ‘em Say it loud, y’all want the new-new Explorer like Dora, that’s how I got a clue too So fucking underground, barely on Youtube 'Till Day N Night, now they all got a clue who Took me a minute man, took me a while Hard headed nigga ever since I was wild, a child But my ambitions made bitches beg for attention DJ’s un-mixin' their mixes, just to toss in some Cudder And I tried to tell my mother But she ain't underdig, figure me on some other But see my mommy 'ain't a fronter So nowadays she calls me a bad motherfucker You might also like And, just when it seemed that the game is hopeless We arranged some thing for a dose of dopeness I, I do, what I do And, I, I do, what I do And, just when it seems that the game is hopeless Rearrange some things for a dose of dopeness I, I do, what I do And, I, I do, what I do  Do my little dance, sippin' out a cup All my people in the back, my people in the front I, I do, what I do And I, I do, what I do, do Do my little dance, sippin' out a cup Pullin' up my pants, she come walkin' up, and I'm like... I, I do, what I do And I, I do, what I do, do  Whoah, Nigga! Y'all motherfuckers need to understand the fuckin' game Shit ain't gon' change unless a motherfucker come in this shit, switch it up Niggas need to open they fuckin' minds, Nigga! 'Cause this is some shit, that y'all niggas ain't ready for Ya underdig, ya understand me? Movin' wit out movin', pure crush froovin' Right on track, right on and I'm back You make songs about some new dances I make songs 'bout the black man advancements I'm talkin' classic homie, I'm talkin' monumental And I don't need much but Dot instrumentals That's how I lay the stencil, me smilin' up out the window I'm in the leaner dome, that's my crib on the moon And I'm livin' in hotel rooms In the mirror, laughing at my crooked tooth How a nigga eat, is how a nigga speak And how a nigga live, is sacrifice was big And I'mma say it right before the hook Maybe in due time, Pimpin', I'mma write a book But now I'mma play my Andre 3000 And dream about an island wit model girls eyein'  Um... hello Hey baby Um... yeah Some people call me Cudi, some people call me Scott It don't matter what you wanna call me, as long as you call me something As long as you call me, baby But um... You know... You seem real pretty And I ain't talkin' bout how you look I'm talkin' 'bout your, your vibe Your vibe is pretty I'm pretty hungry, you want to go get something to eat? Sip on something? Where we going? The moon...10Embed",0.11,0.817,0.073,-0.9789
77,77,Kid Cudi,,Dose Of Dopeness [Official Remix] (Ft. Ke'Ondris),,"Yeah Whoa oh oh oh Yeah Whoa oh oh  Movin' wit out movin', Pure Crush Groovin' Right on track, right on and I'm back Rap Ex-Lax yeah, I be pooin' on 'em Damn right, Mr. Cudi he be dippin' on 'em Say it loud, y'all want the new-new Explorer like Dora, that's how I got a clue too So fucking underground, barely on Youtube 'Till Day N Nite, now they all got a clue who Took me a minute man, took me a while Hard headed nigga ever since I was wild, a child But my ambitions made bitches beg for attention DJ's un-mixin' their mixes, just to toss in some Cudder And I tried to tell my mother But she ain't underdig, figure me on some other But see my mommy 'ain't a fronter So nowadays she calls me a bad motherfucker  x2 And, just when it seemed that the game is hopeless We arranged some things for a dose of dopeness I, I do, what I do And, I, I do, what I do You might also like Kid cudi keondris is tha dopest My selfish little buddy like 2 poke shyt Like ford im focus Dissapear like hocus pocus You bogus I own this flow You drowning in tha water slow fish If you did every drug in existance you still wouldn't be dope so Im so consistant I put my ice t in her coco I thought I was tha coolest and tha coodest till I I tried sniffing coke and got ice stuck up my nose These bitches frooze Female subzeros Made her do a full spilt and the I told her pose Jolly green giant Fee fi foe fum With jack bean stalk Im about to beat up like a drum  Niggas need to open they fuckin' minds, Nigga! Cause this is some shit, that Ya'll niggas ain't ready for  Moovin' wit out moovin', Pure Crush Groovin' Right on track, right on and I'm back You make songs about some new dances I make songs 'bout the black man advancements I'm talkin' classic homie, I'm talkin' monumental And I don't need much but Dot instrumentals That's how I lay the stencil, me smilin' up out the window I'm in the leaner dome, that's my crib on the moon And I'm livin' in hotel rooms In the mirror, laughing at my crooked tooth How a nigga eat, is how a nigga speak And how a nigga live, is sacrifice was big And I'mma say it right before the hook Maybe in due time, Pimpin', I'mma write a book But now I'mma play my Andre 3000 And dream about an island wit model girls eyein' Um... Hello... Hey Baby... Um...yeah Some people call me CuDi Some people call me Scott It don't matter what you want to call me, as long as you call me something As long as you call me, Baby But Um... You know... You seem real pretty And I ain't talkin' bout how you look I'm talkin' about your vibe Your vibe is pretty But, I'm pretty hungry, you want to go get something to eat? Sip on something? Where we going? The Moon...Embed",0.101,0.804,0.095,-0.8114
78,78,Kid Cudi,Entergalactic,Do What I Want,Take a Daytrip & Russ Chell & Roy Lenzo & Levi Carter,"Stay off the weed Hm-hm, hm-hm Hm-hm (Roy, baby), hm-hm (Day-Day-Daytrip took it to ten, hey)  While I cough up this blunt, I sit back in the cut All my niggas ridin' with me, more excuses to stunt And we fill up the cup, and we fill up the Woods Loud bang out the truck and the Range lookin' good Get your girl off her, hey, said she ready to play It's all a game, it's all a game, and I'm doin' my thang More rage, more rage, black Porsche in the rain Someone stop me, bitch, get off me, man, my life ain't the same Natural killer, born and suddenly feelin' in pain Now it's like I'm on my Sepeher and I'm feelin' them games Been through hell and back, made it, it's a wrap Can't keep a nigga down, down, baby, that's a fact And I rep it, Cleveland, city runnin' through my veins To BK, East New York, and I never change Uh-uh, keep my niggas close, just like I'm supposed 'Cause this is for my people, truth is what I wrote, uh-huh  And I feel like I can do what I want Livin', livin', livin', livin', I'ma do what I want (Let's go) And I feel like I can do what I want Livin', livin', livin', livin', I'ma do what I want (Let's go) And I feel like I can do what I want (Yeah-yeah) Livin', livin', livin', livin', I'ma do what I want (Let's go) And I feel like I can do what I want (Yeah-yeah) Livin', livin', livin', livin', I'ma do what I want (Yeah-yeah, hey) You might also like Feel like writin' a movie, yeah, that shit would be groovy Anything that I want, anything that will move me Next step, I'm on my shit and I'm livin' with love And I'm crushin' all praises to my angels above Take a trip, a couple women, couple shrooms with the group Set a mood to the tune, rockstar in the news Rockstar on your tube, nah, my nigga, you lose Keep my head up, never let up and my face what I choose (Woah, baby) On this journey, fronto burnin', castin' signs in the clues And I'm drippin', yes, you catchin' Virgil tag on the shoes Can't forget I'm on zoom, Cudder back on the moon (The moon, the moon) Cudder back on the moon  And I feel like I can do what I want Livin', livin', livin', livin', I'ma do what I want (Let's go) And I feel like I can do what I want Livin', livin', livin', livin', I'ma do what I want (Let's go) And I feel like I can do what I want (Yeah-yeah) Livin', livin', livin', livin', I'ma do what I want (Let's go) And I feel like I can do what I want (Yeah-yeah) Livin', livin', livin', livin', I'ma do what I want (Yeah-yeah)3Embed",0.083,0.762,0.156,0.9423
79,79,Kid Cudi,A Kid Named Cudi,Down & Out,OutKast,"Chka-chka, ah Hit 'em Plain Pat, what up? Ah-ah, ah-ah, ah-ah-ah-ah Ah-ah, ah-ah, ah-ah-ah-ah I ain't playing no more Ah-ah, ah-ah, ah-ah-ah-ah Ah-ah, ah-ah Hey  This is my story, this is my song If you feel it, motherfucker, you can't go wrong To the screw-face niggas, what you on? Get off that, get a goal and focus dog See, I'm what you need, you fiending now Ask around and I bet you'll figure out How to zone and control your future, wow Yeah, I think I'm in the future too I'm unlike fools who proceed to choose To be like them, I be like who I be like me, Mister K-I-D S-O-L-O, D-O-L-O See, the Lord adore me, He met me halfway ""No guts, no glory"", I always say So until I reach what I came here to find Along with inner peace, life will always be a grind One day I'll be what the world want me to be I was born to be super-duper Scott The one bad bitches called super-duper lame Now super-duper fame gets me super-duper brains 86 the cape, but I'm super-duper high Soaring past the moon, a super-duper lonely guy You might also like Down and out, so I'm out and down then Looking for a substance to drown in, hey Down and out, so I'm out and down then Looking for a substance to drown in  For even in Hell I still have faith To one day be free with my Father at the Gates But make no mistakes, I'll show you what time takes To be a success on Earth, mixed with all the hate I stand on my pivot, my life, you could not live it For the things that I've seen have been too damn explicit But soon you will get it on a CD with some credits I provide my grind, mixed with no edits They say they don't want me when I'm fucked up and forgotten Until I rise up amongst the evils trying to stop 'em Slow down, bitch, my money is what I'm clocking I'm tick-tocking, once I start, I ain't stopping Such bullshit that my soul deal with When my room's dim lit, I pray to God to help with, uh My endeavors, in any kind of weather Hoes be pleather-fake, so I erase 'em out my sim Now do you wanna be him? Think twice You'd commit suicide tryna read my mind Now do you wanna be him? Think twice You'd commit suicide tryna read my mind Down and out Hey, down and out, out Down and out, so I'm out and down then Looking for a substance to drown in, hey Down and out, so I'm out and down then Looking for a substance to drown in Down and out, so I'm out and down then Looking for a substance to drown in, hey Down and out, so I'm out and down then Looking for a substance to drown in Down and out, so I'm out and down then Looking for a substance to drown in, hey Down and out, so I'm out and down then Looking for a substance to drown in Down and out, so I'm out and down then Looking for a substance to drown in, hey Down and out, so I'm out and down then Looking for a substance to drown in  Down and out Down and out Down and out Down and out Yeah, yeah Okay, okay This how we gon' do it Plain Pat presents A Kid Named Cudi Hello All the time, nigga All the grind, nigga32Embed",0.179,0.704,0.117,-0.9966
