,Unnamed: 0,Artist,Album,Song Title,Producer,Lyrics,neg,neu,pos,compound
0,0,Kid Cudi,Dat Kid From Cleveland,09' Freestyle,EV,"Even though all my friends lookin at me like who knew it Run to it The hoods just spit by new nigga Feel cats talkin like who nigga Is he Where did he come from CL My mom prayed for me on my journey Treat me like an alien something like sigourney Live through the game for the fame and the gurney Tried to put me on the pedestal Hoes treated me like who are you Now I get to choose like you and her too I just like girls not whores But I have a chill time make s'mores But if I wanna plow someone like a snow blower I can work that ass like a workout plan And then I holla at fam Talkin bout Ye, Don C., Jigga man Been representing since I met 'Quence and I get style tips from my homeboy Ibn Common's the homie Really Doe is the homie GLC is the homie And Big Sean what a gwan' I go monkey paw on the record and they think I’m cookoo Niggas is sign and dated like they recorded in fubu Most niggas will quote you play scrabble with your words man Till you see them at your shows is my dick that they blow man I would sit up some nights and think about my own place Probably cause I took so many blunts of Kush to the face My bad thoughts I can’t erase Or eat what’s on the devils plate I just tell the devil wait Cause murder will not be the case In london with hudson And them girls want some cuttin I’m with him so I’m cool Plus my face on the telly But I’m pissed at the moment I got charged for some roamin' AT&T is some bullshit man I wish they’d stop frontin' But when I roll back to brooklyn Hit the store for a dutchie I say homie keep rappin I say homie its nothin I’m This is Dream on Now when I roll back to cleveland Hit the store for a phillie Niggas tell me keep rappin Cause them young niggas feel me Hear me Hah hem Hear me Yep yep Hear me Yep yep yep Hear me Hear me When I roll out to cali Hit the store for a swisher Niggas tell me keep rappin I say homie I get'cha Hear me Hear me Cudder This is the Dopest shit Hope Niggas like that shit (""Dream On"", ""Dream On"")You might also like9Embed",0.155,0.701,0.143,-0.972
1,1,Kid Cudi,Man on the Moon III: The Chosen,4 da Kidz,LEN20 & Kid Cudi & WondaGurl & MIKE DEAN & Dot Da Genius & 18YOMAN & Take a Daytrip,"Mm-mm, hm, yeah Nah-nah-nah-nah-nah-ah, nah-nah-nah, nah-nah Yeah (Yeah, oh) This song is dedicated to you (Ooh) We got you (Ooh) Yeah (Mmm)  Do it all day for the kiddies (Yeah) Real-life dreamers in the suburbs and the cities (Come on) Ridin' 'round town, windows up, steamin', beamin' (Yeah) Singin' along to it in the cut, heavy streamin' (Yeah) Mama don't know what a lil' nigga feelin' (Nuh-huh) Daddy been gone and my brothers stay trippin' (Uh) For every lil' homie that's lonely This is all for you, give a fuck about the phony (Yeah) All in the plan, as you grow, make the moments last (Huh) Even though in life, it seems the shit moves fast Codе to the realest, hands high, feel this (Yеah) Smoke one to the head, but remember, shit's vicious (Come on) Never lose hope, if you don't, you'll be golden (Yeah) Always keep your family close, keep your heart open Here's to the chosen, solo dolo rollin', hm  This is just the right vibe, turn it loud if you need to (To) Stars in the sky, they will light your way through (Through) Feelin' alone, just know you are not We won't leave you alone, oh-oh This is just the right vibe, turn it loud if you need to (To) Stars in the sky, they will light your way through (Through) Feelin' alone, just know you are not We won't leave you alone, oh-oh You might also like Since day one, I been tryna feel alive (Baby) Doin' what I wanna, go fast and hold tight Seein' what I'm seein', the pain, I will write (Yeah) Ooh, we're children in the night (Come on) Nigga with a vision, hope it come into fruition Yeah, I know it well, dreamin', intermission now Things are gettin' better, waited my whole life, oh, my, my, my, my (Yeah) As we glidin' through the streets This is just the moment where you truly feel free Got my blunt up to the heavens (Ah), tell 'em not to worry, no (Ah) Guided by the moon, how I do what I do (Yeah) Everything's copacetic, push the limit (Uh-huh) Been in this hell so long I know soon, peace will find you (Yeah)  This is just the right vibe Stars in the sky Feelin' alone, just know you are not We won't leave you alone (Oh-oh)  This is just the right vibe, turn it loud if you need to Stars in the sky, they will light your way through Feelin' alone, just know you are not We won't leave you alone, oh-oh (Mm, mm, mm) (Mm, mm, mm) (Yes, look what I have created) (I have made fire)12Embed",0.108,0.737,0.155,0.9709
2,2,Kid Cudi,Prime Day Show x Kid Cudi,4 da Kidz (Prime Day Show x Kid Cudi),Take a Daytrip & 18YOMAN & Dot Da Genius & MIKE DEAN & WondaGurl & Kid Cudi & LEN20,"Dah-dah-dah-dah-dah-ah, dah-dah-dah, dah-dah Yeah (Yeah, oh) Yeah, oh Yeah, oh Yeah (Mmm)  Do it all day for the kiddies (Yeah) Real-life dreamers in the suburbs and the cities (Come on) Ridin' 'round town, windows up, steamin', beamin' (Yeah) Singin' along to it in the cut, heavy streamin' (Yeah) Mama don't know what a lil' nigga feelin' (Nuh-huh) Daddy been gone and my brothers stay trippin' (Uh) For every lil' homie that's lonely This is all for you, give a fuck about the phony (Yeah) All in the plan, as you grow, make the moments last (Huh) Even though in life, it seems the shit moves fast Code to the rеalest, hands high, feel this (Yeah) Smoke onе to the head, but remember, shit's vicious (Come on) Never lose hope, if you don't, you'll be golden (Yeah) Always keep your family close, keep your heart open Here's to the chosen, solo dolo rollin', hm  This is just the right vibe, turn it loud if you need to (To) Stars in the sky, they will light your way through (Through) Feelin' alone, just know you are not We won't leave you alone, oh-oh This is just the right vibe, turn it loud if you need to (To) Stars in the sky, they will light your way through (Through) Feelin' alone, just know you are not We won't leave you alone, oh-oh You might also like Since day one, I been tryna feel alive (Baby) Doin' what I wanna, go fast and hold tight Seein' what I'm seein', the pain, I will write (Yeah) Ooh, we're children in the night (Come on) Nigga with a vision, hope it come into fruition Yeah, I know it well, dreamin', intermission now Things are gettin' better, waited my whole life, oh, my, my, my, my (Yeah) As we glidin' through the streets This is just the moment where you truly feel free Got my blunt up to the heavens (Ah), tell 'em not to worry, no (Ah) Guided by the moon, how I do what I do (Yeah) Everything's copacetic, push the limit (Uh-huh) Been in this hell so long I know soon, peace will find you (Yeah)  This is just the right vibe Stars in the sky Feelin' alone, just know you are not We won't leave you alone (Oh-oh)  This is just the right vibe, turn it loud if you need to Stars in the sky, they will light your way through Feelin' alone, just know you are not We won't leave you alone, oh-oh Yeah, yeah Yeah, woah, yeahEmbed",0.111,0.721,0.167,0.9757
3,3,Kid Cudi,A Kid Named Cudi,50 Ways to Make a Record,Plain Pat & Emile Haynie,"You sit and think about how you can hit the scene Take one look inside your mirror, clear to see You need to find yourself as honest as can be There must be fifty ways to make a record Now don't get wrapped into the hype and what they think This shit ain't rocket science and the scene changes with beats And now you ask yourself, how you want to be seen? There must be fifty ways to make a record He's up inside the clubs, they like to lean and rock, oh Stands around and looks intrigued by what he saw, now he asks me How he can make hit songs to reach the top There must be fifty ways to make a record Fifty ways to make a record   You got talent and your soul cannot be bought He looked and smiled at me and told me ""Thanks a lot"" See, I could use your help And would you please explain about the fifty ways? It's kind of easy if you have a open mind This game is more than spending money and fuckin' dimes It's all within your words, some shit that outlives time There must be fifty ways to make a record Fifty ways to make a recordYou might also like19Embed",0.037,0.835,0.128,0.9424
4,4,Kid Cudi,Speedin’ Bullet 2 Heaven,Adventures,Plain Pat & Kid Cudi,"And we're floating out to nowhere No safety, fall, we'll land safely  Inadequate, feeling so unwanted (Yeah-yeah) Think I want to disappear (Yeah-yeah) From the fire calling (Yeah-yeah) Damn, that is so unfair Inadequate, feeling he is so unwanted (Yeah-yeah) Think I want to disappear (Yeah-yeah) From the fire calling (Yeah-yeah) Damn, that is so unfair How could I care? How could I care? How could I care?  And we're floating out to nowhere No safety, fall, we'll land safely (Hmm)  Lost in my reflection, how do I chill? Only crazy makes sense, hmm, it's starting to make sense While I'm still Her vagina is moist and warm I'll keep you safe, just hold my arm Hell is beyond the door Heaven doesn't want one more No more chicken sandwiches Yes, I'll pay for the damages I explore through the galaxy nightly, hmm, numb my body (Numb my body) Accept yourself, except yourself Exit yourself, access yourself You might also like Oh, oh-oh, oh-oh-oh-oh. oh, oh-oh-oh-oh-oh, eoh Yo, oh-oh, oh-oh-oh-oh. oh, oh-oh-oh-oh-oh, oh Oh No safety, fall, we'll end safely Inadequate, feeling so unwanted (Yeah-yeah) Think I want to disappear (Oh) No safety, fall, we'll land safely (Oh, oh) Oh, oh, oh, oh, oh (Why?, why?, why?, oh) Meh, meh, meh, meh, meh Paranoid  ""That song was kinda freaking me out, Butthead. 'And we're floating out in nowhere...'"" ""No safety, fall, we will land safely, Beavis."" ""Kind of makes me think about my life, you know? ""What life?"" ""Yeah, yeah, exactly. The part like, you know, 'and we're floating out in nowhere...'"" ""Don't worry, Beavis, we will land safely."" ""How come you're talking like that, Butthead?"" ""Like what?"" ""Come on, stop it."" ""I'm not talking any differently than I normally talk, Beavis. Take some of these mushrooms that Cudi gave us, they'll make you feel better."" ""Stop talking like that, Butthead."" ""Like what, Beavis?"" ""You're freaking me out."" ""Take some mushrooms, Beavis. Take some."" ""Oh boy, these mushrooms suck. But they're fast acting, aren't they? These taste horrible."" ""Eat them all, Beavis."" ""They're doing something. Hold on a second. Give me some more."" ""Come with me, Beavis, to burning man. Take some.""10Embed",0.18,0.657,0.163,-0.7712
5,5,Kid Cudi,Indicud,Afterwards (Bring Yo Friends) (Ft. King Chip & Michael Bolton),Kid Cudi,"Sexy Hmm, yeah, oah, oh Mm-oh, mm-oh, mm-oh, mm-hmm  Have us a good time, and I ain’t gonna lie Got some friends around, nigga slide by Have us a good time and I ain’t gonna lie Got some friends around me, got some friends around me Have us a good time, and I ain’t gonna lie Got some friends around, nigga slide by Have us a good time and I ain’t gonna lie Got some friends around me, got some friends around me  Hmm-oh, hmm-oh, oh Yeah Got that bounce We got you Wake it  We should go to my home Afterwards, come on Bring your friends, we should go to my home Afterwards, come on We should go to my home Afterwards, come on Bring your friends, we should go to my home Afterwards, come on Bring your friends You might also like Bring your friends Bring your friends  My people be on across the globe Don't box me in, claustrophobe Tonight we alive, we should give em a show And my living room dance floor is ready to go See, my people be on across the globe Don't box me in, claustrophobe Tonight we alive, we should give 'em a show And my living room dance floor is ready to go  (Bring your friends) Ready to go (Bring your friends) Ready to go  We should go to my home Afterwards, come on Bring your friends, we should go to my home Afterwards, come on We should go to my home Afterwards, come on Bring your friends, we should go to my home Afterwards, come on Bring your friends Bring your friends Bring your friends  Bring your friends Bring your friends Bring your friends Bring your friends Bring your friends Bring your friends  Just bounce, no hands (Oh, mm) Girl I'll show you how to do this dance, just bounce, no hands (Oh, mm) Girl I'll show you how to do this dance, just bounce, no hands (Oh, mm) Girl I'll show you how to do this dance, just bounce, no hands (Oh, mm) Girl I'll show you how to do this dance, just bounce, no hands Girl I'll show you how to do this dance, just bounce, no hands Girl I'll show you how to do this dance, just bounce, no hands (Oh, no, no, no, no, no, no, no, no, no, no, no, no, no, no, no, no, no) Girl I'll show you how to do this dance, just bounce, no hands (Oh, no, no, no, no, no, no, no, no, no, no, no, no, no, no, no, no, no) Girl I'll show you how to do this dance, just bounce Girl I'll show you how to do this dance, just bounce, no hands (Oh no, eh) Girl I'll show you how to do this dance, just bounce, no hands Girl I'll show you how to do this dance Just bounce with me (No hands) Just bounce with me (Girl I'll show you how to do this dance) Just bounce with me (No hands) Just bounce with me (Girl I'll show you how to do this dance) Ain't it nice, ain't it nice, so right, come rage with me Ain't it right, so nice, yeah, come rage with me, yeah Mmm, mm-nah, mm-mm-mm So right, so right, so nice, come rage with me, yeah Yeah Oh, oh, oh8Embed",0.222,0.611,0.166,-0.9699
6,6,Kid Cudi,,Alien (Demo) (Ft. Ant Clemons),FNZ & Bongo & Ronny J,"Turned to a Mothra, bro, this that Godzilla Turned to a monster, more like Othello Phantom of the opera, it goes where it goes My nightmares still haunt me  (Dream) When I sleep, they haunt me When I sleep, they haunt me And my nightmares, they haunt me But I won't let 'em get the best of me  Hmm Alien, alien Extraterrestrial, flying in Seen so much shot, they in love with him I'm out the window, cut through the wind Alien, alien All about lovin' my team to win Ain't no excuses, we runnin' in Me and my future, we shall begin Trippin' out on this LSD Takin' the journey beyond the weed I float around 'till we find the key Couple girls, they my family Here I am, here I am Holdin' the bean since I was ten Open your mouth for the stars and then Hop on the board and we soarin' in Nigga can never be tamed, I fall the hard I weather the rain I been on my Space Ops Watch out for shady cops And I pimp for the fallen, no stolen, my car And been here for a minute now Learn from my destiny And I'm hearin you Lord Oh, I'm hearin' you Lord, oh, I'm hearin' you Lord I'm hearin' you Lord, oh, I'm hearin' you Lord Alien, alien Fall right through Hell and come back again Fly to Hell in this whip we're in Alien, alien You might also like3Embed",0.112,0.796,0.092,-0.6474
7,7,Kid Cudi,Man on the Moon: The End of Day,Alive (Nightmare) (Ft. Ratatat),Ratatat,"So mean So mean  Every time the moon shines I become alive, yeah And every time the moon shines I become alive, yeah  I'm feeling strange in the night I'm not myself, I feel I'm thrown into a fight Ah, nowhere to run, nowhere to hide, nothing's right My skin is burning and my heart begins to speed There's something going wrong with me I am changing rapidly, ay I'm feeling stronger, more alert, I'm on the move, mm I smell her scent, and I know I will find her soon, soon, soon The one to come and free me from this fate I'll find her, it's not too late, hey, hey  Every time the moon shines I become alive, yeah And every time the moon shines I become alive, yeah You might also like I'm a beast in the night I'm on the prowl while I'm hoping to find some light You call it Heaven, I do too, we feel the same Ain't nothing wrong, I'll be feasting on something brave, ay A sexy lady who's pure, she has the cure, ah I hope she can find the man within the beast, and I hope she saves me from the curse I have to beat, hey I hope she figures out a way to save my soul Yeah, to save my heart, hey  Every time the moon shines I become alive, yeah And every time the moon shines I become alive, yeah  Na-na-na-na-na-na-na-na, na Whoa, na-na-na-na-na-na-na, na Na-na-na-na-na-na-na-na, na Whoa, na-na-na-na-na-na-na, na  I watch the sun collapse and took up in the clizzoud I am the lone wolf, go where I wanna Let the moon shine, be the guide to the lizzight Even when I stray away, the light never left me Uh, I learn to follow my instinct Blinded by the light, rather that than the evil Feelin' out of place in a room full of people Try and be the same, but you know you're not a sequel Your fate will be Whatever it shall be, be, be, be, be Won't fight no more I let these things just be, be, be, be Every time the moon shines I become alive, yeah And every time the moon shines I become alive, yeah  Na-na-na-na-na-na-na-na, na Whoa, na-na-na-na-na-na-na, na Na-na-na-na-na-na-na-na, na Whoa, na-na-na-na-na-na-na, na30Embed",0.058,0.776,0.166,0.9823
8,8,Kid Cudi,Man on the Moon II: The Legend of Mr. Rager,All Along,Emile Haynie,"Hey Ma-ma-ma, ma-moon Hey Ma-ma-ma, ma-moon  When the days change So does my attitude I'm messy at home I eat a lot of junk food When the nights change So do my nightmares too I dream reality Is my dream  All along All along I guess I'm meant to be alone All along All along I guess I'm meant to be alone Out there on my own Yeah You might also like When the weeks change The rumors change too I'm addicted to highs Would you like to know why? When the months change So do my love point of views I don't want what I need What I need hates me What I need hates me  I know all along All along I know I'm meant to be alone It's crazy But all along All along I knew I was meant to be alone Out there on my own, yeah  Suppose somehow the lionhearted Failed to win Who will be the villain? All the strangers voted for him Suppose somehow the lionhearted Failed to smile Who will be the villain? All the strangers voted for him All along All along I guess I'm meant to be alone All along All along I guess I'm meant to be alone Out there on my own, yeah45Embed",0.165,0.742,0.093,-0.944
9,9,Kid Cudi,"Passion, Pain & Demon Slayin’",All In,Mike WiLL Made-It,"Ohhhh, ahhhh Ohhhh, ohhhh Ummmm, ohhhh  Hold on, let me explain Sometimes I just don't know what to believe in And I hate things that I said, I didn't mean them (Hm-hm) So difficult tryna piece my thoughts Don't wanna be no burden, I always piss you off How could a man not wanna disappear? (Hmm)  I'm exposed and I am pure No one makes me feel secure Except you and now we're all in All in, I am all in Whatever happens, happens We're all in, all in I am all in Whatever happens, happens  Why all the fussin', I can explain I know your heart is all in no one takes your place I hate the man that I was, so unbecoming (Hm-hm) We're learning together anyhow We're learning together right now Facing the man that I was, tired of running You might also like I'm exposed and I am pure No one makes me feel secure Except you and now we're all in All in (We're all in deep, baby), I am all in Whatever happens, happens We're all in, all in I am all in Whatever happens, happens  Happens, happens, happens, happens, happens All in, all in, all in Happens, happens, happens, happens, happens All, all in, all in, all in, all in, all in Whatever happens, happens16Embed",0.096,0.832,0.073,-0.8033
10,10,Kid Cudi,Speedin’ Bullet 2 Heaven,AMEN,Kid Cudi,"I can see through you (See through) I can see through you Yeah, oh-oh Yeah, oh-oh Yeah, oh-oh Yeah, nah  Amen, yeah yeah, amen I will slay them, I will save men (Ah) The demons walk around with an appetite, I see 'em Demons walk around in daylight, I see 'em Amen, I will slay them (Yeah-eh)  Oh, beware of the manic man, uh, oh A man can equal bandstand, oh Rip faces up with my bare hands, uh, oh You fake niggas and bitches (I see you ho! I see you) Yeah, I know you're wearing a mask, da-ra Yeah, I know you're wearing a mask, da-da-ra Get out with your phony ass, da-da-ra Keep your stories and your phony plans, dum-da-ra  Amen (Hol' up), amen I will slay them, I will save men Demons walk around with an appetite Demons walk around in daylight And I will slay them, I will save men You might also like Oh, beware of the manic man, uh, oh A man can equal bandstand, oh Rip faces up with my bare hands, uh, oh You fake niggas and bitches Yeah, I know you're wearing a mask, da-ra Yeah, I know you're wearing a mask, da-da-ra Get out with your phony ass, da-da-ra Keep your stories and your phony plans, dum-da-ra  Amen (Yeah), amen (Yeah, yeah yeah) I will slay them, and I will save men Demons walk around with an appetite Demons walk around in daylight (Yeah, yeah) Amen, I will slay them  Yay! Oh, oh Oh Amen, da-ra-ra1Embed",0.097,0.711,0.192,0.9623
11,11,Kid Cudi,Entergalactic,Angel,Kid Cudi & Dot Da Genius & Justin Raisen & SADPONY & Jean Baptiste,"Mm, hm, mm  You're such an angel in your halo Such an angel in your halo Where'd you come from? Where'd you come from? Where'd you come from? Where'd you come from? Angel in your halo  Tell me, tell me your side of it You're like the sunrise, it's like you know me And I'm so lost in a dream When asleep, there'll you be  You're such an angel in your halo Such an angel in your halo Where'd you come from? Where'd you come from? Wherе'd you come from? Where'd you comе from? Angel in your halo  Mm Mm, mm, mm Mm, mm Mm, mm Mm, mmYou might also likeEmbed",0.026,0.912,0.062,0.5061
12,12,Kid Cudi,,Angels & Demons,Kid Cudi,"Yeah Nah nah, nah nah Yeah Cudder Clipse Yeah It sound like huh It's what it sound like right?  I am so unstable I am so unstable It's the world that I'm livin in Filled with angels and demons I am so unstable I am so unstable It's the world that I'm livin in Filled with angels and demons I am so unstable I am so unstable It's the world that I'm livin in Filled with angels and demons I am so unstable I am so unstable It's the world that I'm livin in Filled with angels and demons You might also like I was born on the pirate ship Hold your tongue to say that Super duper nervous all the time Never chill back Never caught slippin', even in my kicks made of ice All day, all day lookin foward to the night Feel like I'mma die any minute, so I live on tracks beyond these limits You should stay free when I partyin and wippin I can hear them coming, the demons like to listen I trip out sippin, I re-lax stoned Never feel safe even if I'm at my home They can still find me, we ridin all the time Hot damn she is fine, hope she party all the time I can be your Eddie, my dick is up and ready The lust takes over, merging all the hours Before I go sour, I step back and look at The evils got me tooken, most cats be shooken  I am so unstable I am so unstable It's the world that I'm livin in Filled with angels and demons I am so unstable I am so unstable It's the world that I'm livin in Filled with angels and demons I am so unstable I am so unstable It's the world that I'm livin in Filled with angels and demons I am so unstable I am so unstable It's the world that I'm livin in Filled with angels and demons  I am so unstable I am so unstable It's the world that I'm livin in Filled with angels and demons I am so unstable I am so unstable It's the world that I'm livin in Filled with angels and demons I am so unstable I am so unstable It's the world that I'm livin in Filled with angels and demons I am so unstable I am so unstable It's the world that I'm livin in Filled with angels and demons2Embed",0.216,0.701,0.083,-0.996
13,13,Kid Cudi,Speedin’ Bullet 2 Heaven,Angered Kids,Kid Cudi,"Yeah Steven, lookout! Yeah Hello, hello, doctor, doctor Doctor, there's something wrong inside of me There's something, I don't know doctor, help me Well is there, is there something I can do? Yeah!  Mmm no remorse, mmm no remorse Got a couple bundles of dynamite And some hand grenades Oh no remorse, oh-oh no remorse You never should've angered the kids  Yeah Na-na, na-na-na-na, na-na The darkness is coming Na-na, na-na-na-na, na-na The darkness is coming (Yeah!) Yeah, oh  No remorse, no remorse (Dangerous force) Hell like you wouldn't believe You might also like Na-na, na-na-na-na, na-na The darkness is coming Na-na, na-na-na-na, na-na The darkness is coming Na-na, na-na-na-na, na-na Oh you fools start running Na-na, na-na-na-na, na-na (Mm-mm-mm-mm) Dead man walking  Mmm (Yeah, yeah) Yeah, yeah, yeah, yeah, right, right, right, right (Mmm) Na, na-na-na-na-na, na-na-na Yeah, yeah, yeah, yeah, yeah, yeah, yeah, yay! Yay! Yeah Left foot, right foot Right foot, Left foot (Yay!) Doctor, what am I to do? What am I to do?  Na-na, na-na-na-na, na-na The darkness is coming Na-na, na-na-na-na, na-na And guess what it's wanting Na-na, na-na-na-na, na-na Fools start running Na-na, na-na-na-na, na-na Dead man walking MmmEmbed",0.237,0.508,0.255,0.2603
14,14,Kid Cudi,Speedin’ Bullet 2 Heaven,Anomaly,Kid Cudi," Yeah This is another story, another anomaly (Mm-mm) Oh, we'll make it gory (Mmm), the ears will bleed (Mm-eh-mm) This is another story (Mmm), of an anomaly (Mmm) I don't know what's taking long (Mmm), I'm still taking long (Mmm)  I'ma free roaming animal (Hmm), I'ma free roaming animal (Hmm) I'ma free roaming animal (Hmm), and I like to feed I'ma free roaming animal, I'ma free roaming animal I'ma free roaming animal, and I like to feed  I see you make that camera, the goose on the beach (Mmm) Oh beautiful horror (Mmm), this is a beautiful horror (Hmm-mm) This is another story of another anomaly (Mmm) We'll make it gory (Mmm), the ears will bleed  Oh, oh Save him, save him, save him, save him Yay!You might also likeEmbed",0.045,0.642,0.314,0.9914
