,Unnamed: 0,Artist,Album,Song Title,Producer,Lyrics,neg,neu,pos,compound
209,209,Kid Cudi,Man on the Moon II: The Legend of Mr. Rager,REVOFEV,Plain Pat & MIKE DEAN & Emile Haynie,"Yeah! Welcome, welcome you! Hey! I am your big brother What do I have to say to the kids?  Let go, life does get tough No need to stress, hold you back too much Let's go, I heard they found a solution Where will you be for the revolution?  Oh, whoa Ooh-whoa, ooh-whoa, ooh-whoa Whoa, whoa Ooh-whoa, ooh-whoa, ooh-whoa Whoa, whoa Ooh-whoa, ooh-whoa, ooh-whoa Whoa, whoa (What do I say to the kids?) Ooh-whoa, ooh-whoa, ooh-whoa  Wake up, things might get rough No need to stress, keeps you down too much Wake up, I heard they found a solution Where will you be for the revolution? You might also like Oh, whoa Ooh-whoa, ooh-whoa, ooh-whoa Whoa, whoa Ooh-whoa, ooh-whoa, ooh-whoa Whoa, whoa (Yeah) Ooh-whoa, ooh-whoa, ooh-whoa Whoa, whoa Ooh-whoa, ooh-whoa, ooh-whoa  I'm so high up, so high up, and I like it, hey I'm so high up, so high up, and I like it, hey I am happy today, this not like other days Somehow I feel okay, somehow I feel okay Ooh-whoa Yeah, whoa, ooh-whoa Yeah, whoa, ooh-whoa Yeah, whoa, ooh-whoa  Oh, whoa (I am your big brother) Ooh-whoa, ooh-whoa, ooh-whoa Whoa, whoa Ooh-whoa, ooh-whoa, ooh-whoa Whoa, whoa (I am your big brother) Ooh-whoa, ooh-whoa, ooh-whoa Whoa, whoa Ooh-whoa, ooh-whoa, ooh-whoa Let go, life does get tough No need to stress, hold you back too much Let's go, I heard they found a solution Where will you be for the revolution?  Revolution, revolution (Hey! Okay, okay!) Revolution, revolution (We are—you are here!) Where will you be for the revolution? Where will you be for the revolution? Where will you be for the revolution?56Embed",0.061,0.785,0.154,0.9726
210,210,Kid Cudi,,Rollin (Remix),,"We Ain't Slept in Weeks Rollin, rollin, rollin We Ain't Slept in Weeks Rollin, rollin, rollin We Ain't Slept in Weeks R-Rollin, rollin, rollin We Ain't Slept in Weeks Rollin, rollin, rollin We Ain't Slept in Weeks Rollin, rollin, rollin We Ain't Slept in Weeks Rollin, rollin, rollin We Ain't Slept in R-Ro-Ro Rollin, rollin, rollin We Ain't Slept in Weeks Poppin bottles, keep em pouring How we rolling, V.I.Pin Its Jackie Chan, who da man? Everybody know its me I keep myself surrounded by some dime pieces every night Tall and short, th-thick and skinny, black and white errtight K-Keep em coming, Make em secret If she with it, she can get it But just wait, gi-give me a minute Ca-Cause right now the room is spinnin Pourin Juice, and kick it in Rollin Blunts, and kick it then Music bumpin, ain't it somethin How they get the smiffin beer Feel the bass, its beatin hard Against our body, make her horny Guess she heard, i get them skittles Thats why she be up all on me 5 huffs of purp, and i still ain't high (Bo-Low) Ten Pack of pills, half way gone, I'm about to (Throw-Up) Throwin up, its all good That just keep my buzz in On the couch, love it The way these girls keeps rubbin? *** Blowing on them sweets, have your boy about to peek I've been rollin, rollin, rollin and I ain't slept in weeks Rollin, rollin, rollin We Ain't Slept in Weeks Rollin, rollin, rollin We Ain't Slept in Weeks Rollin, rollin, rollin We Ain't Slept in Weeks R-R-Rollin, rollin, rollin We Ain't Slept in Weeks Rollin, rollin, rollin We Ain't Slept in Weeks (Ah-oh-oh) Rollin, rollin, rollin We Ain't Slept in Weeks (Ah-oh-oh-uh-oh) Rollin, rollin, rollin We Ain't Slept in Weeks (Ah-oh-oh) Rollin, rollin, rollin We Ain't Slept in Weeks Wordd....I can't feel the left side of my face Stressful thoughts have been replaced With Henny and coke and Jaeger man Jackie told me, pump my breaks I told him pass me somethin to bop Told me not to smoke my weed I-I should listen, i can't stop Grabbin models by the arm I tell em to fuck with Moon Man They dont even trip on my aggression Then you slowly take my hand Then they open up and say Do you want to play with me I-I-I say Baby I'm all up on it My hotel is down the street This is kind of how it is When you living young and fast Managements player alive Bitches dancin, shakin ass Zulu try to pass me the blunt I told em that Im'ma have to pass Cause if I decide to smoke it I-I will go to meener land With my man, not so bad Diffefernet from reality I try and tell my nigga man Melwesky Hope my mom ain't mad at me My lifestyle is a wild life with style And my brain on drugs I won't stop it till im numb Tellin myself the night is young Rollin, rollin, rollin (Young-Yeahh, Yeahh) We Ain't Slept in Weeks Rollin, rollin, rollin We Ain't Slept in Weeks Rollin, rollin, rollin (Yeah, yeah) We Ain't Slept in Weeks R-R-Rollin, rollin, rollin We Ain't Slept in Weeks Rollin, rollin, rollin (Purple Planes) We Ain't Slept in Weeks (Green Spades) Rollin, rollin, rollin (Naked Ladies) We Ain't Slept in Weeks (Superman) Rollin, rollin, rollin (Superstars) We Ain't Slept in Weeks (Oh My God!) Rollin, rollin, rollin We Ain't Slept in Weeks, weeks, weeksYou might also likeEmbed",0.042,0.877,0.081,0.9735
211,211,Kid Cudi,"Passion, Pain & Demon Slayin’",Rose Golden (Ft. WILLOW),Kid Cudi & MIKE DEAN & Plain Pat,"Two, three, four Ohhh-oh-ohh  Oh, since I was young, been grooving to my own drum Ain't that many teachers show me my potential Felt like a failure, Mama said, ""You know better"" Future in my hands, God, she had a plan Stronger than I know, soon I'd understand The power I possess, the story of the Chosen Oh, since I was young, been grooving to my own drum Ain't that many teachers show me my potential Felt like a failure, Mama said, ""You know better"" Future in my hands, God, she had a plan Stronger than I know, soon I'd understand The power I possess, the story of The Chosen  Hmm, hey Hmm, hmm, na-na-na-na-na-nah The story of The Chosen, Rose Golden Mmm, mmm  Looking where we're at How did we make it through this level all in one piece? Hmm, oh, oh Oh, where them friends now? I don't see 'em And if I do, I don't sense the truth in 'em Distancing myself while I'm focusing, fo-focusing Don't pretend to worry bout shit Go through one ear and out the other Better off saying nothing, nigga As I shine on and dream on, our vibes are on Had one trip of a dream back in 2003 Who am I? And who will I be? Will I be free? I need a sign, oh I need a sign You might also like Oh, since I was young, been grooving to my own drum Ain't that many teachers show me my potential Felt like a failure, Mama said, ""You know better"" Future in my hands, God, she had a plan Stronger than I know, soon I'd understand The power I possess, the story of The Chosen  Hmm, hey Hmm, hey, na-na-na-na-na-na The story of The Chosen, Rose Golden Mmm, mmm  Look at who you are, how could it be? All I ever wanted was to find some inner peace Mmm, oh, oh, oh Where them haters now? I don't hear 'em (They must be delusional) to think they fucking with me, though I put that on my soul, can't love, they jealous, so jealous, and some Learning day to day, humans Spread love to all my sisters and brothers, let's do better Stop judging a nigga because they're different We're supposed to groove to our own tune So woke from that one tripped out dream back in 2003 (Oh, who am I?) And who do I see, baby? The stars will align, the stars will align Oh, since I was young, been groovin' to my own drum Ain't that many teachers show me my potential Felt like a failure, Mama said, ""You know better"" Future in my hands, God, she had a plan Stronger than I know, soon I'd understand The power I possess, the story of The Chosen Oh, since I was young, been grooving to my own drum Ain't that many teachers show me my potential Felt like a failure, Mama said, ""You know better"" Future in my hands, God, she had a plan Stronger than I know, soon I'd understand The power I possess, the story of The Chosen  Hmm, hey Hmm, hey, na-na-na-na-na-nah The story of The Chosen, Rose Golden Hmm, na-na-na-na-na-nah The story of The Chosen56Embed",0.06,0.794,0.146,0.99
212,212,Kid Cudi,Man on the Moon III: The Chosen,Sad People,Kid Cudi & Dot Da Genius & Take a Daytrip,"Mm-mm, yeah Mm-mm  In the dead of the night, I have these dreams What'll happen to me? Will I burn out? Have I been wrong? What does it mean? All these things, can't understand why Say something's wrong with me, I know By myself alone driving, I go Full moon as it glows, I search for truth Tryna be brand new, yeah, I will try No, I won't do but through these screams Fighting and bleed, blood in my eye And I'll be (Another broken soul) God save me (Yeah)  Yeah, baby, see I'm back in my zone Just what I need, mama (Yeah) Nigga been in hell, the same ol' On a mission and I'm gonna fly high (High) This for the sad pеople who keep the blunt burning and we Off on a journеy, you learn me You might also like Close call, life on the edge Ahh, when the time comes, I'll find peace Still in search of, nights, I'm sittin' wishin' I can find love in me Lettin' go, ooh, this ain't livin' I swim in pain Never drown, keep my head up above the waves (Get it, get it) Tired of runnin', I won't run from fate Late night, ooh, this is when I come alive, when the dreams made Take me, ooh, just don't leave, babe Come on, woah (Don't say goodnight) Scars on my heart, woah (Ahh, ahh, ahh, yeah)  Yeah, baby, see I'm back in my zone Just what I need, mama (Yeah) Nigga been in hell, the same ol' On a mission and I'm gonna fly high (High) This for the sad people who keep the blunt burning and we Off on a journey, you learn me19Embed",0.164,0.673,0.163,-0.6631
213,213,Kid Cudi,Prime Day Show x Kid Cudi,Sad People (Prime Day Show x Kid Cudi),Take a Daytrip & Dot Da Genius & Kid Cudi,"Do-do-do-do-do-do Do-do Yeah Do-do-do-do-do-do Do-do  In the dead of the night, I have these dreams What'll happen to me? Will I burn out? Have I been wrong? What does it mean? All these things, can't understand why Say something's wrong with me, I know By myself alone driving, I go Full moon as it glows, I search for truth Tryna be brand new, yeah, I will try No, I won't do but through these screams Fighting and bleed, blood in my eye And I'll be (Another broken soul) God save me (Yeah)  Come on baby, see I'm back in my zone Just what I need, mama (Yeah) Nigga been in hell, the same ol' On a mission and I'm gonna fly high (High) This for the sad pеople who keep the blunt burning and we Off on a journеy, you learn me You might also like Close call, life on the edge Ahh, when the time comes, I'll find peace Still in search of, nights, I'm sittin' wishin' I can find love in me Lettin' go, ooh, this ain't livin' I swim in pain Never drown, keep my head up above the waves (Get it, get it) Tired of runnin', I won't hide from fate Late night, ooh, this is when I come alive, when the dreams made Take me, ooh, just don't leave, babe Come on, woah (Don't say goodnight) Scars on my heart, woah (Ahh, ahh, ahh, yeah)  Come on baby, see I'm back in my zone Just what I need, mama (Yeah) Nigga been in hell, the same ol' On a mission and I'm gonna fly high (High) This for the sad people who keep the blunt burning and we Off on a journey, you learn meEmbed",0.164,0.685,0.151,-0.8502
214,214,Kid Cudi,KiD CuDi presents SATELLITE FLIGHT: The journey to Mother Moon,SATELLITE FLIGHT,WZRD," ""This is the Rocket Powered Space Capsule. All systems are go."" And the story goes, a young man will come And save the universe from the forces of evil  Take a second to adjust to the ride They say if this was a crime, it'd be federal Lately I've been feelin' invincible As I'm tryna find my way, can't nothing hold me though I say, get a clue, the vibes all around you Try but you can't deny when it's in your soul Let's take it where there aren't any roads Where these sucka hatin' niggas can't follow, baby  Take it to the satellite, tonight Take flight to the moon Come get in my space whip to the satellite, tonight Take flight to the moon Take a ride No worries, no worries, no worries, no worries  Come on don't be shy, let your guard down and work it Do just what you want, anything you choose I tell ya, there's no way we could lose Have you ever seen the Earth from this view? I bet not You might also like Take it to the satellite, tonight Take flight to the moon Come get in my space whip to the satellite, tonight Take flight to the moon Take a ride, take a ride, take a ride, take a ride And now, the vibes  Yeah, yeah, yeah Heavy little thoughts get jumbled in a bundle And they're tucked deep down in the back of my brain Heavy little thoughts get jumbled in a bundle And they're tucked deep down in the back of my brain Heavy little thoughts get jumbled in a bundle And they're tucked deep down in the back of my brain All is life and all is pain Down the hallway of my endless fate  Take it to the satellite, tonight Take flight to the moon Come get in my space whip to the satellite, tonight Take flight to the moon Take a ride, take a ride Come on, yea Take it to the satellite, tonight Take flight to the moon Come get in my space whip to the satellite, tonight Take flight to the moon Take a ride, take a ride Come on, yea Come on, dream on Come on, come on Dream on, no worries Wicked112Embed",0.125,0.81,0.065,-0.9806
215,215,Kid Cudi,,Satellite Flight: The Journey to Mother Moon Album Art,,   Tracklist: 1. Destination: Mother Moon 2. Going To The Ceremony 3. Satellite Flight 4. Copernicus Landing 5. Balmain Jeans Feat. Raphael Saadiq 6. Too Bad I Have To Destroy You Now 7. Internal Bleeding 8. In My Dreams 2015 9. Return Of The Moon Man (Original Score) 10. Troubled Boy17Embed,0.2,0.7,0.1,-0.7184
216,216,Kid Cudi,A Kid Named Cudi,Save My Soul (The CuDi Confession),Danger Mouse,"I got some bad news this mornin' Which in turn made my day  Lord help me out Save my soul, need to find a new route I don't even hear what other niggas talking 'bout Call me a hipster as long as you're a listener Label me what you like I'm close to my victory, dozed in the fight When I open my eyes somehow seeing night Beyond tryna see what being rich feel like Six-figure checks for my mom for peace Everybody wanna stick on me like leech Take my blood, give fake love 'Til I turned them down, now I'm the one who changed, bruh? Ask why I don't call 'Cause when I was starving, you wasn't at all Around, now I gotta shut shit down Be a man, pick friends, all selective now You're cool, you're cool, fuck you And to the bitch that—oh yeah, fuck you too Tried to shine, now everyone knows Yeah, Kid Cudi slipped up and loved them hoes We all make mistakes, yes No worries, I just kill a bitch with success While she at home stressed out eating ice cream I'm at the Grammys living out a nice dream No bitch on arm Just my words and my stoner charm And my dimples deep, I smile at peace 'Cause I went out and got what most y'all seek Now I'm the one you meet Who throws you the peace sign, missed not one step And this is just the first step God walks with me, but I'm still vexed You might also like Oh, how could this be? All this time, I've lived vicariously Who's gonna save my soul now? Who's gonna save my soul now?13Embed",0.115,0.707,0.177,0.9497
217,217,Kid Cudi,Man on the Moon II: The Legend of Mr. Rager,Scott Mescudi vs. the World (Ft. CeeLo Green),Emile Haynie,"What up, how is everyone doing? You are now in a world I am ruling Take a minute to adjust for the wondrous Clusterfuck of fun and enchantment I promise you some ""generation next"" shit Speak for the silent who are left with Parallel levels in a dark, dark place Tricked all you niggas to a dark, dark fate And guided you all with a smile upon my face As the sun kisses us on our foreheads gently Gentle with the drugs, heavy with the love And my speeches on stage rock mountains from a club Money doesn't move me except on the literal G4 flights, now we're off to Australia I wanna see more of the world These are more than just words, these are facts from a winner  This is a journey into the horizon You can see past, if it's real to you We can meet on the other side On the other side, ayy This is a journey into the horizon You can see past, if it's real to you Then we can meet on the other side On the other side You might also like What up, how is everyone feeling? I hope you understand what you're hearing Take a minute to roll up for the wondrous Clusterfuck of darkness and evil I will paint the Yin and the Yang for you And my jeans are Dior for the love of skinnies Upgraded, faded aided to the T Work hard, making sure I don't become a memory Hard to press on when the memories remember me And they always find the perfect moment High speed, my momentum won't slow up none Lost in the wind, I've lost all my friends Maybe they were never meant to be acquainted Money seems to make everything tainted Everybody mad 'cause they stuck where I knew 'em last Took what I wanted and I did it all blunted, oh oh  This is a journey into the horizon You can see past, if it's real to you We can meet on the other side On the other side, ayy This is a journey into the horizon You can see past, if it's real to you Then we can meet on the other side On the other side  This is a journey into the horizon You can see past, if it's real to you We can meet on the other side On the other side, ayy This is a journey into the horizon You can see past, if it's real to you Then we can meet on the other side On the other side31Embed",0.049,0.842,0.109,0.9807
218,218,Kid Cudi,Speedin’ Bullet 2 Heaven,Screwed,Kid Cudi,"Ayy-oh-oh, ayy-oh-oh, ayy-oh-oh, oh-oh  I've been trying to steer, been trying to steer it right It's apparently clear how I might be screwed The end is near, said the end is nearing It's apparently clear we might be screwed When life loses appeal, when the ghosts appear Just a kid in the moonlight, just a kid in the moonlight Headlights on a deer, headlights on the fear Just a kid in the moonlight  Rahm, rahm Rahm, rahm (Hmm) Rahm, rahm (Hmm) Rahm, rahm (Hmm) Rahm, rahm Ayy-oh-oh, ayy-oh-oh, ayy-oh-oh, oh-ohYou might also like4Embed",0.12,0.827,0.052,-0.7717
219,219,Kid Cudi,Speedin’ Bullet 2 Heaven,Séance Chaos,Kid Cudi,"Wondering if you could possibly help me I'm looking for something, I need something to need a fix I need something that will give me a little bit of a boost Wondering if you could possibly help me, possibly help me I'm looking for something, I need something to need a fix I need something that will give me a little bit of a boost  Yeah, oh, oh Chaos, chaos, chaos, chaos, chaos Start the séance (Yeah) Them weirding things are vicing 'Till I finally say alright Never will I close my eyes I like to see my speaker smile (Oh) Hello birdie, what's the wording? How do you do, how do you play? Climb your mountain, think you're a fountain Don't you get to ride my face Play the teacher, I'll play the student Play the asshole on stage Play the clitoris code is morse A thousand thank you's way too late (What's the case?)  Through the agony and strife, I see my so called stinking life Through the agony and strife, I see my so called stinking life Through the agony and strife, see my so called stinking life Through the agony and strife, see my so called stinking life So called stinking lifeYou might also like2Embed",0.203,0.642,0.155,-0.9585
220,220,Kid Cudi,Man on the Moon III: The Chosen,Sept. 16,Kid Cudi & Emile Haynie & FINNEAS & Plain Pat & Dot Da Genius,"Here I am, oh All night, all night, takin' me, oh Lay awake in bed and I'm alone (Remembering) Runnin' through my brain and I'm searchin' for you, oh no (I'm remembering) Missin' someone in my life, see, I'm in trouble And every time I close my eyes, I see her face, see I'm in trouble No, I can't forget her at all, haunting me And I'm wishin' you were mine, all for me  Life goes by Search for your love wherever it be Life goes by I need your love all over me Life goes by Search for your love wherever it be Life goes by Oh, I need your love all over me  Na-na-na-na-na-na, oh, I need your love all over me Na-na-na-na-na-na, oh, oh Na-na-na-na-na-na, oh, I need your love all over me Na-na-na-na-na-na, ooh, mmm You might also like You're a star, I worship you Didn't you know? How couldn't you? As she laughs, sun's shinin' through You're my drug, my dose of truth Anywhere, all you As you lay beside me Just us two, who knew You'd be my everything? (Here I am, oh, here I am, oh) All night, all night, takin' me, oh (Girl, you're takin' me, oh, girl, you're takin'—)  Life goes by Search for your love wherever it be Life goes by I need your love all over me Life goes by Search for your love wherever it be Life goes by Oh, I need your love all over me  Na-na-na-na-na-na, oh, I need your love all over me Na-na-na-na-na-na, oh, oh Na-na-na-na-na-na, oh, I need your love all over me Na-na-na-na-na-na, ooh, mmm Ooh, ooh Ooh, ooh Ooh, ooh Ooh, ooh Na-na-na, na Na-na-na18Embed",0.043,0.763,0.194,0.9947
221,221,Kid Cudi,,Sept. 18,Plain Pat & Dot Da Genius & FINNEAS & Kid Cudi & Kid Jacob,"Here I am, oh All night, all night, takin' me, oh Lay awake in bed and I'm alone (Remembering) Runnin' through my brain and I'm searchin' for you, oh no (I'm remembering) Missin' someone in my life, see, I'm in trouble And every time I close my eyes, I see her face, see I'm in trouble No, I can't forget her at all, haunting me And I'm wishin' you were mine, all for me  Life goes by Search for your love wherever it be Life goes by I need your love all over me Life goes by Search for your love wherever it be Life goes by Oh, I need your love all over me  Na-na-na-na-na-na, oh, I need your love all over me Na-na-na-na-na-na, oh, oh Na-na-na-na-na-na, oh, I need your love all over me Na-na-na-na-na-na, ooh, mmm You might also like You're a star, I worship you Didn't you know? How couldn't you? As she laughs, sun's shinin' through You're my drug, my dose of truth Anywhere, all you As you lay beside me Just us two, who knew You'd be my everything? (Here I am, oh, here I am, oh) All night, all night, takin' me, oh (Girl, you're takin' me, oh, girl, you're takin'—)  Life goes by Search for your love wherever it be Life goes by I need your love all over me Life goes by Search for your love wherever it be Life goes by Oh, I need your love all over me  Na-na-na-na-na-na, oh, I need your love all over me Na-na-na-na-na-na, oh, oh Na-na-na-na-na-na, oh, I need your love all over me Na-na-na-na-na-na, ooh, mmm Ooh, ooh Ooh, ooh Ooh, ooh Ooh, ooh Na-na-na, na Na-na-naEmbed",0.043,0.763,0.194,0.9947
222,222,Kid Cudi,Rap Hard,Shed A Little Light,Kid Cudi,"Wake up in the morning same shirt same jeans Wishing of the rich life, I roll when I lean Not knowing what that life or that day bring Wonder what if the light shines bright what if i can't see If I do what I do to get through, then that's what I'mma do Pure focus when I spew, having been in a pew for some time now But that don't necessarily mean I'm hell bound Stuck in my ways, hoping better days come through the cracks Every day same thing: eat, sleep, shit, rap Then shake it, mice running round my damn sticky trap Ants on the plates and food, rapping the only thing cool My mood chilling in my staring up at the ceiling Nigga my life day to day is lord willing The dry wall pillars metaphors for my feelings Yeah, starting a new life no more drug dealing nigga  Let me shed a little light for my niggas in the dark Let me shed a little light for my niggas All my niggas on that day to day grind tryna' to live they dreams Just trying to get this cream Let me shed a little light for my niggas in the dark Let me shed a little light for my niggas All my niggas on that day to day grind tryna' to live they dreams Just trying to get this cream You might also like When I was younger I told myself I wouldn't smoke That was the biggest joke I'm addicted to these ports like they're pure coke I'm selling this journey out with no real route World thought I wanna go, all I really know is that I'm making moves Whether it's robbing fools or making people groove my nigga You know I'm choosing something I remeber getting older and not caring 'bout nothing All I knew was that I had a destiny; that was my sixth sense I grind with six cents, and spent six years of rap I'm hungry, Chris just made it happen You know Mescudi, I was tired of being Picture this; two bedrooms and four siblings I slept on the couch for 14 years of my life Finally copped him a bed in the living room it's alright Let me shed a little light, I'mma crawl out the dark And I'mma grind till the end till my life's cut off nigga  Let me shed a little light for my niggas in the dark Let me shed a little light for my niggas All my niggas on that day to day grind tryna' to live they dreams Just trying to get this cream Let me shed a little light for my niggas in the dark Let me shed a little light for my niggas All my niggas on that day to day grind tryna' to live they dreams Just trying to get this cream1Embed",0.149,0.767,0.083,-0.9887
