,Unnamed: 0,Artist,Album,Song Title,Producer,Lyrics,neg,neu,pos,compound
132,132,Kid Cudi,KiD CuDi presents SATELLITE FLIGHT: The journey to Mother Moon,Internal Bleeding,Kid Cudi," Hmm, oh Woah  I done tried it all, tried it all, hey Done tried it all, I can't stop this internal bleeding (Hmm) And my heart is leaking, heart is leaking out Tried it all, tried it all, hey Done tried it all, I can't stop this internal bleeding (Hmm) And my heart is leaking, heart is leaking out Tried it all, tried it all, hey Done tried it all, I can't stop this internal bleeding (Huh) My heart is leaking, heart is leaking out Tried it all, tried it all, hey Done tried it all, I can't stop this internal bleeding My heart is leaking And it hurts  Oh, uh Cut me down, slice me deep, I dare you Burn my crown, spit on my grave, I’ll make you See my face, see my face, I’ll haunt you Deep in the dark, behind your eyes, I’m on you Salt of the Earth, bird of the Heavens, you hear them All in the hell, the hollowest halls, don’t fear them Here I am, the warrior man Here I stand, the warrior man You might also like But I done tried it all, tried it all, hey Done tried it all, I can’t stop this internal bleeding (Hmm) My heart is leaking, heart is leaking out Tried it all, tried it all, hey Done tried it all, I can’t stop this internal bleeding (Hmm) My heart is leaking, heart is leaking out And it hurts me  Oh-oh-oh-oh Oh-oh-oh-oh-oh Oh-oh-oh-oh-oh Oh-oh-oh-oh Oh-oh-oh-oh Oh-oh-oh-oh-oh Oh-oh-oh-oh-oh Oh-oh-oh-oh Oh-oh-oh-oh Oh-oh-oh-oh-oh Oh-oh-oh-oh-oh Oh-oh-oh-oh Oh-oh-oh-oh Oh-oh-oh-oh-oh Oh-oh-oh-oh Oh85Embed",0.067,0.873,0.059,-0.6305
133,133,Kid Cudi,A Kid Named Cudi,Intro (A Kid Named Cudi),Plain Pat & Emile Haynie,"Goddamn nigga, watch your feet Chill out man With your big ass head Whatever You gon sit right in front of me Get fucked up Huh?, Nah man, them shits is nasty Yo, hello? Gimme some of that popcorn Chill man, get your own shit Huh? Sup babe, I'm at the movies right now Damn nigga, why you got so much butter on this shit? Nah, I'm gonna come by later and get that though Yeah, have you seen this shit? Supposed to be good tho Get your hand outta my pocket Let me holla at you, the movie is about to start Oh my god, what the fuck, do you smell that? Damn, shh, yo Pat, shh, chill dude Damn, what the fuck? Chill out Shit's startedYou might also like2Embed",0.29,0.65,0.061,-0.9899
134,134,Kid Cudi,A Kid Named Cudi (Re-Release),Intro (A Kid Named Cudi Re-Release),Plain Pat & Kid Cudi,"Alright Yeah Come on, I think we, um, F17, F18? Which way- which way is that? It's here Okay Excuse me Excuse me, excuse me Ah! Sorry! Didn't mean to step on your foot Let's see, F18 Boom Yo, man, can you believe it's been 14 years since the first one? Damn! Well, that makes sense, though You know that nigga Cudi 'bout 45? For real? Mhm, look it up Sweet Jesus! Let me get some popcorn Damn, we been looking forward to this shit Did you hear that?You might also likeEmbed",0.104,0.752,0.144,0.0387
135,135,Kid Cudi,Dat Kid From Cleveland,Intro (Dat Kid From Cleveland),EV,"Hey, he's a man He's a short man, the shortest man you'll see It's DJ E-V, he's the shortest man you'll see Rolling with the K-I-D C-U-D-I It's DJ E-V, he's the shortest DJ you'll see Hey! Yo, uhm, holla at me my nigga, haha We doing it big We not playing games, Kid Cud I love everybody I love the hate I love the positive I love everything man Show me love when you meet, when you see me You know how to holla, dream onYou might also likeEmbed",0.049,0.68,0.272,0.9783
136,136,Kid Cudi,A Kid Named Cudi,Is There Any Love? (Ft. Wale),Emile Haynie,"Heads up, nigga Wale Plain Pat Emile  Off jump boo, Cudi give you funk Hit you in your head then it work it to your rump Hatin' niggas can't hate, leave 'em all stumped They gotta like a nigga, call me Obama Not a hypebeast while you beast for the hype (no no) Yeah I'm the underdog, story of my life (yup) Matter fact I dreamed that I lived twice Once as a slave who imagined being free And made it all happen for his family and his seed And now me, you can call me Mr. Friendly One life to live, but no acting on my nigga Friendy Can't stand evil bitches with they Fendi All they do is envy and plot up on my loins I give you options baby flip a coin You get McDonald's, forget the sirloin Hating my macking, they asking  Is there any love In this world? Is there any love In this world? Is there any love In this world of ours? Is there any love In this world? You might also like Folarin, the muse of the hater That music is greater, stupid nigga, bring your face up Bamas surprised, deprived from attention Pride of the district all rise so they listenin' From where gorillas territorial for inches When it come to pistols, these niggas don't John Lynch them Off rip that's genius You niggas so-so like seamstress No more amore, I refuse to force you Maybe I lack the fortitude to try to court you Of course, they all hate Early adapters agree they all late So what that say about my watch? To y'all minds I'm like a UK clock Hours ahead, so wack niggas is sayin' What they sayin', young? They sayin' What they sayin', young? They sayin'?  Is there any love In this world? Is there any love In this world? Is there any love In this world of ours? Is there any love In this world? I was born to do the damn thing Story of Cudi, nigga getting out my dreams Zero options to choose Living in a box full of Cuyahoga blues, and listen I stayed away from reading The Plain Dealer Most of my niggas back in Cleveland were plain dealers, uh Who whipped Supremes, the candy-painted eyes But the love from the boppers had 'him watchin they rise Wasn't no love for a nigga in the smug Sipping out a cup, a concoction for cruising High off life? My nigga, not even I'ma go to war with the Devil 'til we're even Bobbing and weaving, spiritual hymn singing No commentary my man, I come out swinging And this will be the song that we sing Any young nigga with visions when he's sleeping  Is there any love In this world? Is there any love In this world? Is there any love In this world of ours? Is there any love In this world?19Embed",0.115,0.668,0.217,0.9973
137,137,Kid Cudi,,JFKPSA,Kid Cudi,"The artist, however faithful to his personal vision of reality, becomes the last champion of the individual mind and sensibility Against an intrusive society and an officious state He has, as Frost said, a lover's quarrel with the world In pursuing his perceptions of reality He must often sail against the currents of his time This is not a popular role Yet in retrospect, we see how the artist's fidelity has strengthened the fibre of our national life If sometimes our great artists have been the most critical of our society It is because their sensitivity And their concern for justice, which must motivate any true artist Makes him aware that our Nation falls short of its highest potential I see little of more importance to the future of our country and our civilization than full recognition of the place of the artist If art is to nourish the roots of our culture Society must set the artist free to follow his vision wherever it takes him We must never forget that art is not a form of propaganda, it is a form of truth For poets, there is nothing worse for our trade than to be in style In free society art is not a weapon and it does not belong to the spheres of polemic and ideology The highest duty of the writer, the composer, the artist is to remain true to himself And to let the chips fall where they may  Hey let's have some fun this timeYou might also like6Embed",0.017,0.79,0.193,0.9929
138,138,Kid Cudi,Speedin’ Bullet 2 Heaven,Judgmental Cunt,Kid Cudi,"This is for all your suffering Judgmental cunt, uh (Ahem) Hmm, mmm Select your potion  Stay tuned, stay tuned Stay tuned, stay tuned  Yeah, you're just some fuck-up little kid Just some loser kid, and you're never ever going to be shit Everywhere he goes, loser little kid Introverted kid, hating everybody type of guy Look at you, dumb punk loser kid You ain't never gon' be shit, somebody told you lies Can't hear a thing, too preoccupied sipping kerosene  Stay tuned, stay tuned Stay tuned, stay tuned  You're just some loser little boy Can't ever do a damn thing right, you'll never be shit They called him the loser, loser boy And you'll never be anything but a fucking lowlife Look at you, dumb stoner little boy You'll never be nothing nigga, don't get this shit twisted Oh, we shall see what fate shall bring You might also like Stay tuned, stay tuned Stay tuned, stay tuned  Yow, yow, help me, yow, how, yow, hey! Yow, yow-yow-yow-yow, how, how, how, yow, how how how, yeah! Hey! Hey! Choose your potion12Embed",0.205,0.735,0.06,-0.9791
139,139,Kid Cudi,Indicud,Just What I Am (Ft. King Chip),Kid Cudi,"I'm just what you made, God, not many I trust I'ma go my own way, God, take my fate to wherever you want I'm out here, on my son, won't stop 'til I get me some Club-hoppin', tryna get me some, bad bitches wanna get me sprung Early in the morning, I'm wakin', bakin', drinkin', contemplatin' Ain't no such thing as Satan, evil is what you make it Thank the Lord for that burning bush That big body Benz I was born to push On my way I'm burning kush, nigga, don't be worried 'bout us Neighbors knockin' on the door, asking can we turn it down I say, ""Ain't no music on"", she said, ""No, that weed is loud"" Nigga, we ballin', straight swaggin', lost Hawk, but I'm maintainin' I've been told that I'm amazing, make sure keep that fire blazin', we livin'  I (I need) need smoke (Oh, oh, oh, I need) I (I need) need to smoke Who gon' hold me down now? I-I wanna get high y'all (Woah) I-I wanna get high y'all Nee-need it, need it to get by y'all (Woah, yeah) Can you get me high y'all? (Hey) I-I wanna get high y'all I-I-I wanna get high y'all Nee-need it, need it to get by y'all Can you get me high y'all? (Hey) You might also like I'm just what you made, God, just what you made, God (Nee-need it) I'm just what you made, God, I'm just what you made (Nee-nee-need it) I'm just what you made, God I'm just what you made, God, I'm just what you made, (Mmm)  Let me tell you 'bout my month y'all Endless shopping, I had a ball I had to ball for therapy, my shrink don't think that helps at all Whatever, that man ain't wearing these leather pants I diagnose my damn self, these damn pills ain't working fam In-In my spare time, punching walls, fucking up my hand I know that shit sound super cray, but if you had my life you'd understand But, I can't fold, some poor soul got it way worse We're all troubled in a world of trouble It's scary to have a kid walk this Earth I'm what you made, God, fuck yes, I'm so odd Thinking 'bout all my old friends who weren't my friends all along Hm, when it rains it pours, whiskey bottles on the sinks and floors Every day to find sane's a chore, amidst a dream with no exit doors  I (I need) need smoke (Oh, oh, oh, I need) I (I need) need to smoke Who gon' hold me down now? I-I wanna get high y'all (Woah) I-I wanna get high y'all Nee-need it, need it to get by y'all (Woah, yeah) Can you get me high y'all? (Hey) I-I wanna get high y'all I-I-I wanna get high y'all Nee-need it, need it to get by y'all Can you get me high y'all? (Hey) I'm just what you made, God, just what you made, God (Nee-need it) I'm just what you made, God, I'm just what you made (Nee-nee-need it) I'm just what you made, God I'm just what you made, God, I'm just what you made (Mmm)  Nee-need it to get by, yeah Willy188Embed",0.086,0.761,0.153,0.9845
